rating,published_at,author_name,review_url,text
1,2024-08-16T10:11:37.021Z,Doki Break,https://www.google.com/maps/reviews/data=!4m8!14m7!1m6!2m5!1sChZDSUhNMG9nS0VJQ0FnSURwd1l1NFJBEAE!2m1!1s0x0:0x8f7d01d87fefd64b!3m1!1s2@1:CIHM0ogKEICAgIDpwYu4RA%7CCgsI2cv8tQYQoNClCg%7C?hl=en,"**Editado de 5 ⭐a 1⭐**

Mi primera vez en este lugar y volveré para probar más pizzas. Tomé por recomendación de una amistad la ""Pizza Crazy"" (creo que se llamaba) y era una delicia. Por si alguien lo pregunta, una pizza si no comes en demasía da para dos personas. El trato muy amable y atento además siendo un grupo grande se organizaron de maravilla. De precio está en la media de un restaurante italiano normal, ni muy barato ni muy caro pero merece la pena completamente. Eso sí, mejor reservad si vais que suele llenarse.

**Edito: ayer tras hacer una reserva para 7, se quedaron sin cubiertos y sin platos. Tras lo cual decidieron que lo correspondiente era traer 5 platos y toda la comida (entre lo que había pasta y pizzas solo marcadas sin cortar, que se rompían al intentarlo). Tras quejarnos reiteradas veces, nos trataron fatal alegando, la encargada del local: ¿Qué comíamos para necesitar cubiertos?
Situación de risa. Al final pudimos comer vinilo de pizza de como estaba de dura la masa y pasta fria ligeramente crocante. Delicatessen. Tras todo, decidieron invitarnos a un postre. Supuestamente en cualquier local si te invitan por una comida nefasta traen algo a todos los comensales, gracioso que en este caso con 2 porciones para 7 decidieron que estaba correcto. Maravilloso trato, veré si vuelvo."
5,2024-08-12T20:59:34.719Z,Rubén,https://www.google.com/maps/reviews/data=!4m8!14m7!1m6!2m5!1sChdDSUhNMG9nS0VJQ0FnSUM3bFAzNGpRRRAB!2m1!1s0x0:0x8f7d01d87fefd64b!3m1!1s2@1:CIHM0ogKEICAgIC7lP34jQE%7CCgwItu_ptQYQuOCe1wI%7C?hl=en,Pizzas riquísimas y una gran variedad. Buena atención al cliente y rapidez en el servicio.
5,2024-08-11T15:54:44.154Z,Belén García,https://www.google.com/maps/reviews/data=!4m8!14m7!1m6!2m5!1sChZDSUhNMG9nS0VJQ0FnSUM3MEpQU01nEAE!2m1!1s0x0:0x8f7d01d87fefd64b!3m1!1s2@1:CIHM0ogKEICAgIC70JPSMg%7CCgsIxL3jtQYQ6IPKSQ%7C?hl=en,
5,2024-07-28T19:45:18.204Z,Mar Vega,https://www.google.com/maps/reviews/data=!4m8!14m7!1m6!2m5!1sChZDSUhNMG9nS0VJQ0FnSUNiNmF6Z0NBEAE!2m1!1s0x0:0x8f7d01d87fefd64b!3m1!1s2@1:CIHM0ogKEICAgICb6azgCA%7CCgsIzr-atQYQ0IzVYQ%7C?hl=en,¡La mejor pizza que he probado en mi vida!
5,2024-07-21T07:37:39.926Z,Pilar Mancebo,https://www.google.com/maps/reviews/data=!4m8!14m7!1m6!2m5!1sChdDSUhNMG9nS0VJQ0FnSURyai1EMW9BRRAB!2m1!1s0x0:0x8f7d01d87fefd64b!3m1!1s2@1:CIHM0ogKEICAgIDrj-D1oAE%7CCgwIw_XytAYQkLjluQM%7C?hl=en,Excelente trato y servicio. La comida espectacular. Sin duda repetiremos
4,2024-07-06T19:11:26.064Z,pedro Garcia,https://www.google.com/maps/reviews/data=!4m8!14m7!1m6!2m5!1sChdDSUhNMG9nS0VJQ0FnSUNybHBLZ3B3RRAB!2m1!1s0x0:0x8f7d01d87fefd64b!3m1!1s2@1:CIHM0ogKEICAgICrlpKgpwE%7CCgsI3q2mtAYQsKHmHg%7C?hl=en,Muy buenas pizzas y entrantes
5,2024-06-29T20:49:33.376Z,Toni RuDo,https://www.google.com/maps/reviews/data=!4m8!14m7!1m6!2m5!1sChZDSUhNMG9nS0VJQ0FnSURoZ0otRWRnEAE!2m1!1s0x0:0x8f7d01d87fefd64b!3m1!1s2@1:CIHM0ogKEICAgIDhgJ-Edg%7CCgwI3eaBtAYQoJSyswE%7C?hl=en,"De las mejores pizzas que he probado, ambiente familiar, una cálidad-precio excelente. Siempre que voy a Quintanar repito."
5,2024-06-23T19:26:53.290Z,Diana cristina Bontas,https://www.google.com/maps/reviews/data=!4m8!14m7!1m6!2m5!1sChZDSUhNMG9nS0VJQ0FnSUNMbC1TM1dnEAE!2m1!1s0x0:0x8f7d01d87fefd64b!3m1!1s2@1:CIHM0ogKEICAgICLl-S3Wg%7CCgwI_e3hswYQ-IjGigE%7C?hl=en,
4,2024-06-14T22:31:11.910Z,anne roman,https://www.google.com/maps/reviews/data=!4m8!14m7!1m6!2m5!1sChdDSUhNMG9nS0VJQ0FnSUNMdU5LSzJBRRAB!2m1!1s0x0:0x8f7d01d87fefd64b!3m1!1s2@1:CIHM0ogKEICAgICLuNKK2AE%7CCgwIr4mzswYQ0PD_sQM%7C?hl=en,
5,2024-06-05T13:43:43.236Z,Mayte Ochoa Rodrigo,https://www.google.com/maps/reviews/data=!4m8!14m7!1m6!2m5!1sChdDSUhNMG9nS0VJQ0FnSUN6dTktbndBRRAB!2m1!1s0x0:0x8f7d01d87fefd64b!3m1!1s2@1:CIHM0ogKEICAgICzu9-nwAE%7CCgsIj9eBswYQiJHYcA%7C?hl=en,"Pizzas buenísimas. Pasta muy rica, buen servicio. Repetiré"
5,2024-05-29T21:32:42.247Z,k Khkl,https://www.google.com/maps/reviews/data=!4m8!14m7!1m6!2m5!1sChdDSUhNMG9nS0VJQ0FnSUN6b0pfWW5nRRAB!2m1!1s0x0:0x8f7d01d87fefd64b!3m1!1s2@1:CIHM0ogKEICAgICzoJ_YngE%7CCgsI-r3esgYQyJiFdg%7C?hl=en,Muy buena atención y sobre todo muy limpio
5,2024-05-13T15:21:35.910Z,Johana Calva,https://www.google.com/maps/reviews/data=!4m8!14m7!1m6!2m5!1sChZDSUhNMG9nS0VJQ0FnSUNUbXRIbUZnEAE!2m1!1s0x0:0x8f7d01d87fefd64b!3m1!1s2@1:CIHM0ogKEICAgICTmtHmFg%7CCgwI_9-IsgYQiPCHsgM%7C?hl=en,"Excelente pizza, muy sabrosa y crujiente.
Recomendando a todos ."
5,2024-05-12T16:55:25.513Z,Juanqui Morales,https://www.google.com/maps/reviews/data=!4m8!14m7!1m6!2m5!1sChZDSUhNMG9nS0VJQ0FnSUNUb3NfbUZREAE!2m1!1s0x0:0x8f7d01d87fefd64b!3m1!1s2@1:CIHM0ogKEICAgICTos_mFQ%7CCgwI_eiDsgYQyJWA9QE%7C?hl=en,"Estuvimos comiendo hoy un par de pizzas y un postre para compartir de nos encantó. La comida con calidad y buena cantidad. Muy recomendable, algo diferente en la zona. Repetiremos seguro."
5,2024-05-01T12:51:22.522Z,Marta Vazquez,https://www.google.com/maps/reviews/data=!4m8!14m7!1m6!2m5!1sChdDSUhNMG9nS0VJQ0FnSURqOHBLRS13RRAB!2m1!1s0x0:0x8f7d01d87fefd64b!3m1!1s2@1:CIHM0ogKEICAgIDj8pKE-wE%7CCgwIyvXIsQYQuKum-QE%7C?hl=en,No sé si hemos disfrutado más con las pizzas o con los postres!!!
5,2024-04-28T18:21:44.147Z,Rosmery Velarde Farfan,https://www.google.com/maps/reviews/data=!4m8!14m7!1m6!2m5!1sChZDSUhNMG9nS0VJQ0FnSURqeUxfc0NnEAE!2m1!1s0x0:0x8f7d01d87fefd64b!3m1!1s2@1:CIHM0ogKEICAgIDjyL_sCg%7CCgsIuKe6sQYQwIK8Rg%7C?hl=en,Excelente lugar
5,2024-04-25T19:13:50.501Z,maria jose trueba collado,https://www.google.com/maps/reviews/data=!4m8!14m7!1m6!2m5!1sChZDSUhNMG9nS0VJQ0FnSUNqaV9fbEN3EAE!2m1!1s0x0:0x8f7d01d87fefd64b!3m1!1s2@1:CIHM0ogKEICAgICji__lCw%7CCgwI7taqsQYQ-Mf87gE%7C?hl=en,Comida increíble no nos cansamos de venir aquí!! Pizzas espectaculares y buenísimas al igual q el resto q se ofrece en la carta
5,2024-04-16T18:28:48.333Z,María Pradillo Toledo,https://www.google.com/maps/reviews/data=!4m8!14m7!1m6!2m5!1sChdDSUhNMG9nS0VJQ0FnSUNqNExiNzBRRRAB!2m1!1s0x0:0x8f7d01d87fefd64b!3m1!1s2@1:CIHM0ogKEICAgICj4Lb70QE%7CCgwI4Ib7sAYQgNH8ngE%7C?hl=en,
5,2024-04-13T20:19:05.778Z,Marina v:,https://www.google.com/maps/reviews/data=!4m8!14m7!1m6!2m5!1sChZDSUhNMG9nS0VJQ0FnSUREa19qcERREAE!2m1!1s0x0:0x8f7d01d87fefd64b!3m1!1s2@1:CIHM0ogKEICAgIDDk_jpDQ%7CCgwIudHrsAYQyJSn8wI%7C?hl=en,"La comida de 10, lo mejor la pizza matajare y la tarta tres leches, el personal muy amable"
5,2024-04-12T21:29:21.245Z,Alejandro Escribano Ocaña,https://www.google.com/maps/reviews/data=!4m8!14m7!1m6!2m5!1sChZDSUhNMG9nS0VJQ0FnSUREcllHemVnEAE!2m1!1s0x0:0x8f7d01d87fefd64b!3m1!1s2@1:CIHM0ogKEICAgIDDrYGzeg%7CCgsIsc_msAYQkOyOdQ%7C?hl=en,Pizzas Pande..lo mejor
5,2024-04-06T19:56:30.865Z,Sandra Sanabrias,https://www.google.com/maps/reviews/data=!4m8!14m7!1m6!2m5!1sChdDSUhNMG9nS0VJQ0FnSURHbjVYTDJRRRAB!2m1!1s0x0:0x8f7d01d87fefd64b!3m1!1s2@1:CIHM0ogKEICAgIDGn5XL2QE%7CCgwI7tHGsAYQ8KzinAM%7C?hl=en,"El local ha cambiado de ubicación, ahora lo tenemos en Quintanar... ¡¡ Yuju !!
Para mi gusto, están mucho más buenas las pizzas de aquí, solo que con un pero. Bajo mi punto de vista es mucha masa y muy poco ingrediente. Pero aún así el sabor del producto en sí es buenísimo.
Y si a eso le sumamos que he descubierto la tarta 3 leches gracias a vosotros... Un pedazo de mi corazón me habéis robado.
Qué placer por favor, se lo recomiendo a todo el mundo probar.
5 estrellas. 😉👌

EDITO: Últimamente he ido alguna que otra vez a tomar un café y un postre y es que... buah! Son increíbles, de verdad.
El tiramisú espectacula, muy suave y jugoso.
La tarta de queso y pistacho... otro nivel!
Y yo como siempre, siempre fiel a la tarta 3 leches... Cómo habré estado tantos años de mi vida sin conocer este postre! Es gloria!!!! 🤤🙏

EDITO2: hemos ido a cenar pizza y están muy buenas. Pedimos la de guanciale y emmental y la crazy, y para nuestro gusto, la crazy estaba buenísima! Volveremos a probar muchas más!

EDITO3: hemos vuelto y hemos probado Matajare y el calzone Texas y ambos buenísimos!! ❤️🤗"
5,2024-03-28T20:43:10.114Z,C.R. O.,https://www.google.com/maps/reviews/data=!4m8!14m7!1m6!2m5!1sChZDSUhNMG9nS0VJQ0FnSUNEcnRfVUVREAE!2m1!1s0x0:0x8f7d01d87fefd64b!3m1!1s2@1:CIHM0ogKEICAgICDrt_UEQ%7CCgsI3qyXsAYQgN_iNg%7C?hl=en,Pizzas muy ricas.
5,2024-03-23T18:39:03.767Z,Mariela Hernandez,https://www.google.com/maps/reviews/data=!4m8!14m7!1m6!2m5!1sChZDSUhNMG9nS0VJQ0FnSUNEaU5Hc0xnEAE!2m1!1s0x0:0x8f7d01d87fefd64b!3m1!1s2@1:CIHM0ogKEICAgICDiNGsLg%7CCgwIx8P8rwYQgIHx7QI%7C?hl=en,"Excelente atención  y servicio  , muy delicioso, te sirven  rápido lo recomiendo, volveré muchas veces más"
5,2024-03-17T13:01:02.936Z,Luis Esquinas,https://www.google.com/maps/reviews/data=!4m8!14m7!1m6!2m5!1sChdDSUhNMG9nS0VJQ0FnSUQ5d2I3WDZBRRAB!2m1!1s0x0:0x8f7d01d87fefd64b!3m1!1s2@1:CIHM0ogKEICAgID9wb7X6AE%7CCgwIjtPbrwYQsNurvgM%7C?hl=en,"Muy profesionales, la comida muy buena. Sitio para repetir.super amables y atentos en todo."
5,2024-03-16T15:03:51.929Z,Álvaro Fernández,https://www.google.com/maps/reviews/data=!4m8!14m7!1m6!2m5!1sChZDSUhNMG9nS0VJQ0FnSUQ5OXJUb2NBEAE!2m1!1s0x0:0x8f7d01d87fefd64b!3m1!1s2@1:CIHM0ogKEICAgID99rTocA%7CCgwI1-nWrwYQuP-1uwM%7C?hl=en,"Lugar increíble para disfrutar de una (o varias) pizzas inmejorables. Fuimos un grupo de amigos y pedimos solo pizzas, por lo que no tuvimos la oportunidad de probar entrantes, pero vamos, tal y como estaban las pizzas no dudo que todo sea igual de espectacular. La atención fue fabulosa y siempre con una sonrisa. Desde luego un gran lugar al que volver."
5,2024-03-16T14:49:44.258Z,Borja Fañanás,https://www.google.com/maps/reviews/data=!4m8!14m7!1m6!2m5!1sChZDSUhNMG9nS0VJQ0FnSUQ5OXBEZkJ3EAE!2m1!1s0x0:0x8f7d01d87fefd64b!3m1!1s2@1:CIHM0ogKEICAgID99pDfBw%7CCgsIiOPWrwYQ0Py1ew%7C?hl=en,Riquísimas todas
5,2024-03-10T07:09:28.452Z,Emilio Díaz-R,https://www.google.com/maps/reviews/data=!4m8!14m7!1m6!2m5!1sChdDSUhNMG9nS0VJQ0FnSUM5MjdYdThBRRAB!2m1!1s0x0:0x8f7d01d87fefd64b!3m1!1s2@1:CIHM0ogKEICAgIC927Xu8AE%7CCgwIqLm1rwYQyM3x1wE%7C?hl=en,
5,2024-02-26T19:22:14.707Z,Piedad Garcia Lorca,https://www.google.com/maps/reviews/data=!4m8!14m7!1m6!2m5!1sChdDSUhNMG9nS0VJQ0FnSURkdzd2QnZnRRAB!2m1!1s0x0:0x8f7d01d87fefd64b!3m1!1s2@1:CIHM0ogKEICAgIDdw7vBvgE%7CCgwI5snzrgYQgOSn0QI%7C?hl=en,
5,2024-02-25T14:55:48.962Z,Willy GC,https://www.google.com/maps/reviews/data=!4m8!14m7!1m6!2m5!1sChdDSUhNMG9nS0VJQ0FnSURkNVpTWjNRRRAB!2m1!1s0x0:0x8f7d01d87fefd64b!3m1!1s2@1:CIHM0ogKEICAgIDd5ZSZ3QE%7CCgwI9KntrgYQsKuUywM%7C?hl=en,Gran sitio!
5,2024-02-10T20:26:34.573Z,Korpa,https://www.google.com/maps/reviews/data=!4m8!14m7!1m6!2m5!1sChZDSUhNMG9nS0VJQ0FnSUNkeU9ld0xnEAE!2m1!1s0x0:0x8f7d01d87fefd64b!3m1!1s2@1:CIHM0ogKEICAgICdyOewLg%7CCgwI-refrgYQ4P3XkQI%7C?hl=en,Maravilloso sitio tranquilo y se come de maravilla hacia tiempo que no comía unas pizzas así de ricas volveré a repetir
5,2024-01-21T19:25:38.731Z,Dulc HEREN SAN,https://www.google.com/maps/reviews/data=!4m8!14m7!1m6!2m5!1sChdDSUhNMG9nS0VJQ0FnSURObXRXZm9nRRAB!2m1!1s0x0:0x8f7d01d87fefd64b!3m1!1s2@1:CIHM0ogKEICAgIDNmtWfogE%7CCgwIst-1rQYQ8N3r3AI%7C?hl=en,Buenísima la comida. Estupendo servicio y local agradable. Repetimos seguro.
5,2024-01-21T15:18:19.723Z,Alvaro Manzaneque,https://www.google.com/maps/reviews/data=!4m8!14m7!1m6!2m5!1sChZDSUhNMG9nS0VJQ0FnSUROcW9DQUF3EAE!2m1!1s0x0:0x8f7d01d87fefd64b!3m1!1s2@1:CIHM0ogKEICAgIDNqoCAAw%7CCgwIu-u0rQYQuOrr2AI%7C?hl=en,"Hemos comido espectacular. 4 adultos y 4 niños y todo ha ido rodado. Rápido, resuelto y riquísimo. Geraldine al servico en mesa y el Pande a las pizzas. ""Mu rico to""...!
Super recomendable!!"
5,2024-01-14T15:07:48.813Z,mario ftizon,https://www.google.com/maps/reviews/data=!4m8!14m7!1m6!2m5!1sChZDSUhNMG9nS0VJQ0FnSUNOenN6TllBEAE!2m1!1s0x0:0x8f7d01d87fefd64b!3m1!1s2@1:CIHM0ogKEICAgICNzszNYA%7CCgwIxPGPrQYQ4OWAhAM%7C?hl=en,
5,2024-01-14T13:57:31.788Z,Ana Belén Novillo,https://www.google.com/maps/reviews/data=!4m8!14m7!1m6!2m5!1sChZDSUhNMG9nS0VJQ0FnSUNOanFyc05REAE!2m1!1s0x0:0x8f7d01d87fefd64b!3m1!1s2@1:CIHM0ogKEICAgICNjqrsNQ%7CCgwIy9CPrQYQsLXm9wI%7C?hl=en,La pizza está riquísima!!
5,2024-01-14T13:56:48.030Z,javi Garcia,https://www.google.com/maps/reviews/data=!4m8!14m7!1m6!2m5!1sChdDSUhNMG9nS0VJQ0FnSUNOanNyeWtBRRAB!2m1!1s0x0:0x8f7d01d87fefd64b!3m1!1s2@1:CIHM0ogKEICAgICNjsrykAE%7CCgsIoNCPrQYQ2K6sDg%7C?hl=en,Estuvimos de paso y fue un acierto total! La pizza Matajare muy rica. Volveremos!
5,2024-01-12T09:11:22.647Z,José,https://www.google.com/maps/reviews/data=!4m8!14m7!1m6!2m5!1sChZDSUhNMG9nS0VJQ0FnSUNObExiNmJREAE!2m1!1s0x0:0x8f7d01d87fefd64b!3m1!1s2@1:CIHM0ogKEICAgICNlLb6bQ%7CCgwIuoSErQYQ2MrvtAI%7C?hl=en,"La experiencia no es solo sabrosa, ¡es pura pasión por la pizza! Pande, el responsable de las pizzas, está siempre creando maravillas. Se nota su habilidad en cada pizza, desde la base hasta la explosión de sabores frescos. Los ingredientes son de primera calidad."
5,2024-01-10T08:22:29.576Z,Álvaro Carrascosa,https://www.google.com/maps/reviews/data=!4m8!14m7!1m6!2m5!1sChdDSUhNMG9nS0VJQ0FnSUQxNjdpM3BnRRAB!2m1!1s0x0:0x8f7d01d87fefd64b!3m1!1s2@1:CIHM0ogKEICAgID167i3pgE%7CCgwIxaf5rAYQqMjekgI%7C?hl=en,"Buen gusto y buen hacer. Mezcla lo tradicional y lo moderno en recetas de pizza maravillosas. La masa está muy rica y bien elaborada y su toque personal acompaña perfectamente.
El mejor sitio de pizzas a más de 100km a la redonda. No tengo duda alguna."
5,2023-12-30T14:25:07.701Z,Andres Comesaña,https://www.google.com/maps/reviews/data=!4m8!14m7!1m6!2m5!1sChZDSUhNMG9nS0VJQ0FnSUMxM3RyZGZ3EAE!2m1!1s0x0:0x8f7d01d87fefd64b!3m1!1s2@1:CIHM0ogKEICAgIC13trdfw%7CCgwIw9DArAYQwMyjzgI%7C?hl=en,"Las mejores pizzas y pastas de la zona. La calidad es excepcional, con muy buenos ingredientes y el trato de los camareros muy bueno. Los fagotti de pera y queso gorgonzola y la pizza Simona fueron nuestros favoritos. No te puedes ir sin probar los postres caseros... increíbles! Volveremos seguro"
5,2023-12-16T01:11:29.967Z,Hector Sanchez,https://www.google.com/maps/reviews/data=!4m8!14m7!1m6!2m5!1sChZDSUhNMG9nS0VJQ0FnSUNoOHNYZ0xREAE!2m1!1s0x0:0x8f7d01d87fefd64b!3m1!1s2@1:CIHM0ogKEICAgICh8sXgLQ%7CCgwIwfLzqwYQqNDIzQM%7C?hl=en,"Muy buena experiencia, las pizzas muy ricas, la masa es lo mejor.
Recomiendo el tiramisú para mí gusto de los mejores que he probado.
Llevamos 1 año desde que conocimos pande y cada día que vamos disfrutamos como niños, es increíble como convierten la pizza en arte.
Pande es muy amable y se nota que pone cariño a sus creaciones"
5,2023-12-08T14:19:40.545Z,Txema Hormigos,https://www.google.com/maps/reviews/data=!4m8!14m7!1m6!2m5!1sChZDSUhNMG9nS0VJQ0FnSUNWbFlhOWR3EAE!2m1!1s0x0:0x8f7d01d87fefd64b!3m1!1s2@1:CIHM0ogKEICAgICVlYa9dw%7CCgwI_MvMqwYQgNDxgwI%7C?hl=en,"Nos dejamos asesorar por el Pande y atinoque total, todo muy rico, la pasta, las pizzas (exageradas) y los postres deliciosos.
100% recomendable y si eres fan de la comida italiana, imprescindible en la zona."
5,2023-12-07T22:57:38.266Z,Jose David Quiralte,https://www.google.com/maps/reviews/data=!4m8!14m7!1m6!2m5!1sChdDSUhNMG9nS0VJQ0FnSUNWeWEzWXJRRRAB!2m1!1s0x0:0x8f7d01d87fefd64b!3m1!1s2@1:CIHM0ogKEICAgICVya3YrQE%7CCgsI4pvJqwYQsOmlfw%7C?hl=en,
5,2023-12-07T08:11:10.090Z,María José González,https://www.google.com/maps/reviews/data=!4m8!14m7!1m6!2m5!1sChdDSUhNMG9nS0VJQ0FnSUNWN3RxbDl3RRAB!2m1!1s0x0:0x8f7d01d87fefd64b!3m1!1s2@1:CIHM0ogKEICAgICV7tql9wE%7CCgsInvzFqwYQuKufKw%7C?hl=en,
5,2023-12-07T00:42:10.831Z,Verónica Castellanos,https://www.google.com/maps/reviews/data=!4m8!14m7!1m6!2m5!1sChdDSUhNMG9nS0VJQ0FnSUNWNXJ1cHRBRRAB!2m1!1s0x0:0x8f7d01d87fefd64b!3m1!1s2@1:CIHM0ogKEICAgICV5ruptAE%7CCgwI4qnEqwYQyJHajAM%7C?hl=en,"Sitio 100% recomendable😊 Las pizzas estaban increíbles, el ambiente ideal para cenar  y el trato ha sido impecable. De los mejores sitios de la zona sin duda."
5,2023-12-06T22:57:41.540Z,Claudia Valles,https://www.google.com/maps/reviews/data=!4m8!14m7!1m6!2m5!1sChdDSUhNMG9nS0VJQ0FnSUNWcHFTNi1nRRAB!2m1!1s0x0:0x8f7d01d87fefd64b!3m1!1s2@1:CIHM0ogKEICAgICVpqS6-gE%7CCgwI5fjDqwYQ0PXGgQI%7C?hl=en,
5,2023-12-06T14:51:09.136Z,Elisa Escobedo Asensio,https://www.google.com/maps/reviews/data=!4m8!14m7!1m6!2m5!1sChZDSUhNMG9nS0VJQ0FnSUNWeXRXbFRnEAE!2m1!1s0x0:0x8f7d01d87fefd64b!3m1!1s2@1:CIHM0ogKEICAgICVytWlTg%7CCgsI3ZTCqwYQoJ2OQQ%7C?hl=en,Pizzas exquisitas!!! De las mejores que he tomado nunca. Y el personal encantador y muy amable. Un lugar muy recomendable.
5,2023-12-06T13:52:25.139Z,Jaume Rojo,https://www.google.com/maps/reviews/data=!4m8!14m7!1m6!2m5!1sChdDSUhNMG9nS0VJQ0FnSUNWaXRuZnV3RRAB!2m1!1s0x0:0x8f7d01d87fefd64b!3m1!1s2@1:CIHM0ogKEICAgICVitnfuwE%7CCgsImfnBqwYQwMSyQg%7C?hl=en,"Si avisas con tiempo tienen queso vegano para las pizzas. Hemos venido varias veces, la masa es increíble y ellos súper amables. Os dejo dos fotos de dos platos con queso vegano: pizza y gnocchi"
5,2023-12-03T15:16:35.375Z,Marisabel Ramos,https://www.google.com/maps/reviews/data=!4m8!14m7!1m6!2m5!1sChdDSUhNMG9nS0VJQ0FnSURsNDZTbHhRRRAB!2m1!1s0x0:0x8f7d01d87fefd64b!3m1!1s2@1:CIHM0ogKEICAgIDl46SlxQE%7CCgwI07eyqwYQ0P-JswE%7C?hl=en,"Muy ricas, una masa buenísima!! Y los postres ummm!!"
5,2023-11-24T21:03:13.799Z,Noelia Cortés De la Guía,https://www.google.com/maps/reviews/data=!4m8!14m7!1m6!2m5!1sChdDSUhNMG9nS0VJQ0FnSUNsblpmTm1nRRAB!2m1!1s0x0:0x8f7d01d87fefd64b!3m1!1s2@1:CIHM0ogKEICAgIClnZfNmgE%7CCgwIkZ-EqwYQ2N60_QI%7C?hl=en,Primera vez que cenamos aquí y nos ha encantado. Hacía mucho que no comiamos unas pizzas tan buenas. Volveremos  seguro!!!
5,2023-11-09T13:21:29.840Z,David Fernández Martínez,https://www.google.com/maps/reviews/data=!4m8!14m7!1m6!2m5!1sChdDSUhNMG9nS0VJQ0FnSURGdmFhMTV3RRAB!2m1!1s0x0:0x8f7d01d87fefd64b!3m1!1s2@1:CIHM0ogKEICAgIDFvaa15wE%7CCgwI2bmzqgYQsPXZkAM%7C?hl=en,
5,2023-11-03T23:03:59.921Z,Alvaro Quintanar,https://www.google.com/maps/reviews/data=!4m8!14m7!1m6!2m5!1sChZDSUhNMG9nS0VJQ0FnSURGMEppQmZREAE!2m1!1s0x0:0x8f7d01d87fefd64b!3m1!1s2@1:CIHM0ogKEICAgIDF0JiBfQ%7CCgwI3_iVqgYQqLTAtwM%7C?hl=en,Un descubrimiento. Las pizzas buenísimas
5,2023-11-01T23:53:13.395Z,antonio añover,https://www.google.com/maps/reviews/data=!4m8!14m7!1m6!2m5!1sChZDSUhNMG9nS0VJQ0FnSUNGczRyTVhnEAE!2m1!1s0x0:0x8f7d01d87fefd64b!3m1!1s2@1:CIHM0ogKEICAgICFs4rMXg%7CCgwI6cmLqgYQyNnBvAE%7C?hl=en,
5,2023-11-01T20:11:06.328Z,ADOLFO,https://www.google.com/maps/reviews/data=!4m8!14m7!1m6!2m5!1sChZDSUhNMG9nS0VJQ0FnSUNGMDU3UUR3EAE!2m1!1s0x0:0x8f7d01d87fefd64b!3m1!1s2@1:CIHM0ogKEICAgICF057QDw%7CCgwI2uGKqgYQiKDMnAE%7C?hl=en,Muy buena calidad-precio!
5,2023-10-29T08:52:51.857Z,cardenio cardenio,https://www.google.com/maps/reviews/data=!4m8!14m7!1m6!2m5!1sChZDSUhNMG9nS0VJQ0FnSUNGMll5SExBEAE!2m1!1s0x0:0x8f7d01d87fefd64b!3m1!1s2@1:CIHM0ogKEICAgICF2YyHLA%7CCgwI47r4qQYQiLrnmAM%7C?hl=en,
5,2023-10-28T12:47:01.439Z,Antonio Sanchez,https://www.google.com/maps/reviews/data=!4m8!14m7!1m6!2m5!1sChdDSUhNMG9nS0VJQ0FnSUNGd1lEMHpRRRAB!2m1!1s0x0:0x8f7d01d87fefd64b!3m1!1s2@1:CIHM0ogKEICAgICFwYD0zQE%7CCgwIxYX0qQYQsJvD0QE%7C?hl=en,Un sitio inmejorable. Las pizzas están genial y el servicio súper bien. Muy recomendable 👌
5,2023-10-15T21:44:47.343Z,Loles Esteve,https://www.google.com/maps/reviews/data=!4m8!14m7!1m6!2m5!1sChZDSUhNMG9nS0VJQ0FnSUM1eFliTWZREAE!2m1!1s0x0:0x8f7d01d87fefd64b!3m1!1s2@1:CIHM0ogKEICAgIC5xYbMfQ%7CCgwIz7qxqQYQiOD1owE%7C?hl=en,"Pizzas artesanas con masa hojaldrada buenísima.
Ensaladas fantásticas!
Totalmente recomendable"
5,2023-10-12T14:55:18.061Z,Vadamar,https://www.google.com/maps/reviews/data=!4m8!14m7!1m6!2m5!1sChZDSUhNMG9nS0VJQ0FnSUM1eXI2eFpnEAE!2m1!1s0x0:0x8f7d01d87fefd64b!3m1!1s2@1:CIHM0ogKEICAgIC5yr6xZg%7CCgsI1pGgqQYQ0NqNHQ%7C?hl=en,"Veniamos de un viaje desde Madrid, con mis dos hijos y mi marido, y buscando un sitio en google maps me aparece esta pizzería con un 4,9 de puntuación, así que paramos aquí a comer y todo un acierto, pizzas buenisimas, a la leña y masa hecha por ellos, y los postres de escándalo, todo casero y personal y lugar, en general, encantador y acogedor, está claro que si volvemos por esta zona vendremos de nuevo, muchas gracias por todo!!"
5,2023-10-08T20:52:10.729Z,Jork,https://www.google.com/maps/reviews/data=!4m8!14m7!1m6!2m5!1sChdDSUhNMG9nS0VJQ0FnSURaajdlVXJBRRAB!2m1!1s0x0:0x8f7d01d87fefd64b!3m1!1s2@1:CIHM0ogKEICAgIDZj7eUrAE%7CCgwI-qyMqQYQiKCA3AI%7C?hl=en,"Muy buen sitio, la chica que servía muy amable. Recomendable y la comida muy buena. Sobre todo las pizzas."
5,2023-10-02T12:55:10.961Z,Antonio Hernandez Martin,https://www.google.com/maps/reviews/data=!4m8!14m7!1m6!2m5!1sChZDSUhNMG9nS0VJQ0FnSURad2Yyd1lBEAE!2m1!1s0x0:0x8f7d01d87fefd64b!3m1!1s2@1:CIHM0ogKEICAgIDZwf2wYA%7CCgwIrvvqqAYQ6JKnygM%7C?hl=en,
5,2023-09-30T12:17:13.331Z,Héctor Cardao,https://www.google.com/maps/reviews/data=!4m8!14m7!1m6!2m5!1sChdDSUhNMG9nS0VJQ0FnSURaMXE2ZDVRRRAB!2m1!1s0x0:0x8f7d01d87fefd64b!3m1!1s2@1:CIHM0ogKEICAgIDZ1q6d5QE%7CCgwIyaPgqAYQ6LeKngE%7C?hl=en,
5,2023-08-26T09:47:21.423Z,Gema Perea,https://www.google.com/maps/reviews/data=!4m8!14m7!1m6!2m5!1sChZDSUhNMG9nS0VJQ0FnSURwdGJ6NEZnEAE!2m1!1s0x0:0x8f7d01d87fefd64b!3m1!1s2@1:CIHM0ogKEICAgIDptbz4Fg%7CCgwIqZSnpwYQwOzayQE%7C?hl=en,"Todo un descubrimiento, las mejores pizzas q he probado.
Sabores increíbles !!!
Calidad inmejorable !!!
Y los postres de 10
Muy buena atención y servicio.
Para repetir seguro."
5,2023-08-22T05:55:31.960Z,Miguel Toribio,https://www.google.com/maps/reviews/data=!4m8!14m7!1m6!2m5!1sChdDSUhNMG9nS0VJQ0FnSURwenM2ZThnRRAB!2m1!1s0x0:0x8f7d01d87fefd64b!3m1!1s2@1:CIHM0ogKEICAgIDpzs6e8gE%7CCgwI05uRpwYQwMr9yQM%7C?hl=en,"Estupenda Pizzería, con riquísimas pizzas y deliciosos postres.
Sitio muy recomendable."
5,2023-08-21T17:57:27.348Z,Pilar FDEZVILLACAÑAS,https://www.google.com/maps/reviews/data=!4m8!14m7!1m6!2m5!1sChdDSUhNMG9nS0VJQ0FnSURwdG8yWnVRRRAB!2m1!1s0x0:0x8f7d01d87fefd64b!3m1!1s2@1:CIHM0ogKEICAgIDpto2ZuQE%7CCgwIh8uOpwYQ2Jq1pgE%7C?hl=en,
5,2023-08-20T13:42:28.217Z,Gloria Rodriguez,https://www.google.com/maps/reviews/data=!4m8!14m7!1m6!2m5!1sChZDSUhNMG9nS0VJQ0FnSURwdXBMaUhnEAE!2m1!1s0x0:0x8f7d01d87fefd64b!3m1!1s2@1:CIHM0ogKEICAgIDpupLiHg%7CCgsIxLCIpwYQoMXfZw%7C?hl=en,"Genial, calidad, simpatía, recomendables sin dudarlo, gracias"
5,2023-08-19T12:06:40.622Z,Angel Ramon Carrion Jimenez,https://www.google.com/maps/reviews/data=!4m8!14m7!1m6!2m5!1sChZDSUhNMG9nS0VJQ0FnSURwOHNTU1ZREAE!2m1!1s0x0:0x8f7d01d87fefd64b!3m1!1s2@1:CIHM0ogKEICAgIDp8sSSVQ%7CCgwI0OCCpwYQsOTzqAI%7C?hl=en,
4,2023-08-19T01:54:33.713Z,Oiane Campos García,https://www.google.com/maps/reviews/data=!4m8!14m7!1m6!2m5!1sChZDSUhNMG9nS0VJQ0FnSURSbDRYVUlREAE!2m1!1s0x0:0x8f7d01d87fefd64b!3m1!1s2@1:CIHM0ogKEICAgIDRl4XUIQ%7CCgwI2cGApwYQiMa11AI%7C?hl=en,Un buen lugar para disfrutar de las pizzas caseras la pasta está buena de sabor pero un poco dura los postres buenísimos y todo casero💋
4,2023-08-07T20:02:51.084Z,isabel coca,https://www.google.com/maps/reviews/data=!4m8!14m7!1m6!2m5!1sChdDSUhNMG9nS0VJQ0FnSUNwMWItWi1nRRAB!2m1!1s0x0:0x8f7d01d87fefd64b!3m1!1s2@1:CIHM0ogKEICAgICp1b-Z-gE%7CCgsI65vFpgYQkK2QKA%7C?hl=en,
5,2023-08-05T19:06:22.503Z,ANGEL JIMENEZ,https://www.google.com/maps/reviews/data=!4m8!14m7!1m6!2m5!1sChZDSUhNMG9nS0VJQ0FnSUNwOFlpc2VBEAE!2m1!1s0x0:0x8f7d01d87fefd64b!3m1!1s2@1:CIHM0ogKEICAgICp8YiseA%7CCgwIrru6pgYQ8Kig8AE%7C?hl=en,"Pizza carbonara riquísima a los chicos les ha encantado, en general a todos, el servicio muy bien"
4,2023-07-22T10:07:07.803Z,Paco,https://www.google.com/maps/reviews/data=!4m8!14m7!1m6!2m5!1sChdDSUhNMG9nS0VJQ0FnSURKN2UtRTRnRRAB!2m1!1s0x0:0x8f7d01d87fefd64b!3m1!1s2@1:CIHM0ogKEICAgIDJ7e-E4gE%7CCgwIy9TupQYQ-Kv2_gI%7C?hl=en,"Cenamos anoche, buena atención y las pizzas 🍕 en su punto....."
5,2023-07-22T02:28:06.440Z,Cristina V,https://www.google.com/maps/reviews/data=!4m8!14m7!1m6!2m5!1sChdDSUhNMG9nS0VJQ0FnSUMtZ0lPVjFRRRAB!2m1!1s0x0:0x8f7d01d87fefd64b!3m1!1s2@1:CIHM0ogKEICAgIC-gIOV1QE%7CCgwItv3spQYQ4NT-0QE%7C?hl=en,"No sabría elegir, están todas espectacularmente buenas. Y la chica que nos atendió es todo un encanto, hemos ido dos veces y repetiremos sin duda!"
5,2023-07-19T06:01:33.444Z,David Ayuso,https://www.google.com/maps/reviews/data=!4m8!14m7!1m6!2m5!1sChZDSUhNMG9nS0VJQ0FnSURKOGV6ellREAE!2m1!1s0x0:0x8f7d01d87fefd64b!3m1!1s2@1:CIHM0ogKEICAgIDJ8ezzYQ%7CCgwIvfjdpQYQqJOG1AE%7C?hl=en,
5,2023-07-11T23:08:27.864Z,Sergio Sanchez Fernandez,https://www.google.com/maps/reviews/data=!4m8!14m7!1m6!2m5!1sChdDSUhNMG9nS0VJQ0FnSURKOU5tWHdRRRAB!2m1!1s0x0:0x8f7d01d87fefd64b!3m1!1s2@1:CIHM0ogKEICAgIDJ9NmXwQE%7CCgwI68G3pQYQqPb-mwM%7C?hl=en,"Las pizzas, en y postres son espectaculares y con buena calidad- precio. Todo esto acompañado de un trato de 10. ¡Repetiremos seguro!"
5,2023-07-07T21:35:49.391Z,M Angeles Escudero Cruzado,https://www.google.com/maps/reviews/data=!4m8!14m7!1m6!2m5!1sChdDSUhNMG9nS0VJQ0FnSUNKbi1LQnVBRRAB!2m1!1s0x0:0x8f7d01d87fefd64b!3m1!1s2@1:CIHM0ogKEICAgICJn-KBuAE%7CCgwItYqipQYQiPTTugE%7C?hl=en,Todo está buenísimo y muy agradable susempleados
5,2023-07-06T05:24:38.783Z,Gregorio Ruescas,https://www.google.com/maps/reviews/data=!4m8!14m7!1m6!2m5!1sChdDSUhNMG9nS0VJQ0FnSUNKaF9QSjhBRRAB!2m1!1s0x0:0x8f7d01d87fefd64b!3m1!1s2@1:CIHM0ogKEICAgICJh_PJ8AE%7CCgwIlqCZpQYQqJi_9QI%7C?hl=en,"Qué rico todo, si señor."
4,2023-06-30T14:04:18.983Z,MDPR,https://www.google.com/maps/reviews/data=!4m8!14m7!1m6!2m5!1sChZDSUhNMG9nS0VJQ0FnSUNKbWRfUk9BEAE!2m1!1s0x0:0x8f7d01d87fefd64b!3m1!1s2@1:CIHM0ogKEICAgICJmd_ROA%7CCgwI4sH7pAYQwLji1AM%7C?hl=en,
5,2023-06-16T11:08:53.194Z,Alicia Vaquero,https://www.google.com/maps/reviews/data=!4m8!14m7!1m6!2m5!1sChdDSUhNMG9nS0VJQ0FnSUR4NTZpVXdBRRAB!2m1!1s0x0:0x8f7d01d87fefd64b!3m1!1s2@1:CIHM0ogKEICAgIDx56iUwAE%7CCgsIxYWxpAYQkLfBXA%7C?hl=en,
