rating,published_at,author_name,review_url,text
5,2025-12-24T14:47:18.625Z,Elena Murat Ágreda,https://www.google.com/maps/reviews/data=!4m8!14m7!1m6!2m5!1sChZDSUhNMG9nS0VJQ0FnTURvdE5TVVVREAE!2m1!1s0x0:0xc7b3314c4370b7f3!3m1!1s2@1:CIHM0ogKEICAgMDotNSUUQ%7CCgwI9pTSwQYQsPDT2wI%7C?hl=en,"Su café ☕️ fenomenal ,y las tostas para desayunar;  la comida variada y casera ,muy buena y a buen precio -rapidez y amabilidad en el servicio  👍 hay que ir.......... vuelvo a incidir  👌 fabuloso.. comida casera ,ambiente familiar y super amables su personal"
5,2025-12-22T14:29:41.981Z,Fernando Javier Benavent Mateos,https://www.google.com/maps/reviews/data=!4m8!14m7!1m6!2m5!1sChdDSUhNMG9nS0VJQ0FnSUNCM3Nmd3hBRRAB!2m1!1s0x0:0xc7b3314c4370b7f3!3m1!1s2@1:CIHM0ogKEICAgICB3sfwxAE%7CCgwI9JeonQYQyMWfjwI%7C?hl=en,
5,2025-12-08T15:27:01.824Z,JMツ,https://www.google.com/maps/reviews/data=!4m8!14m7!1m6!2m5!1sCi9DQUlRQUNvZENodHljRjlvT2pFeGJXUlRhR1JhVFROWVowSkhOSFpzTm5wYU1HYxAB!2m1!1s0x0:0xc7b3314c4370b7f3!3m1!1s2@1:CAIQACodChtycF9oOjExbWRTaGRaTTNYZ0JHNHZsNnpaMGc%7C0dCit4l8efH%7C?hl=en,El servicio buenísimo nos atendieron a las 4 de la tarde de un día festivo .
5,2025-11-30T13:24:30.907Z,Antonio A. Desdea Bajo,https://www.google.com/maps/reviews/data=!4m8!14m7!1m6!2m5!1sCi9DQUlRQUNvZENodHljRjlvT2sxclYxWnlkbUpGTTBSNmQzUTRUaTFOZDB4UFVtYxAB!2m1!1s0x0:0xc7b3314c4370b7f3!3m1!1s2@1:CAIQACodChtycF9oOk1rV1ZydmJFM0R6d3Q4Ti1Nd0xPUmc%7C0dA3LDq6-oE%7C?hl=en,Fui anoche a cenar y quedamos sorprendidos con la comida. Nos pedimos una ración de oreja y unos bocadillos y quedamos mas que llenos. De muy buena calidad tanto la comida como el servicio. Repito visita sin duda ya!!
5,2025-11-02T16:36:25.364Z,jesus manuel Ramos Lominchar,https://www.google.com/maps/reviews/data=!4m8!14m7!1m6!2m5!1sCi9DQUlRQUNvZENodHljRjlvT2xCTWVXbFBkMDVtYTFaNmVqRTBkM1ZMV1VsNVVXYxAB!2m1!1s0x0:0xc7b3314c4370b7f3!3m1!1s2@1:CAIQACodChtycF9oOlBMeWlPd05ma1Z6ejE0d3VLWUl5UWc%7C0d0sX8Kh4DN%7C?hl=en,"Comi con mi familia, un lugar agradable y un trato fabuloso. Recomendado. Precios muy competentes"
5,2025-11-02T16:33:43.667Z,Aiden Botía Barberà,https://www.google.com/maps/reviews/data=!4m8!14m7!1m6!2m5!1sCi9DQUlRQUNvZENodHljRjlvT21od1VucHliMG90Y1hGUlRYVlZSMmxGUkhSWFdGRRAB!2m1!1s0x0:0xc7b3314c4370b7f3!3m1!1s2@1:CAIQACodChtycF9oOmhwUnpyb0otcXFRTXVVR2lFRHRXWFE%7C0d0sUbbn2aX%7C?hl=en,"El trato inmejorable, la comida excelente, sitio perfecto para ir con amigos o familia. La ensalada caprichosa, la hamburguesa especial y el cochinillo muy recomendado. 10/10"
5,2025-11-02T16:27:04.412Z,Violeta Villaba,https://www.google.com/maps/reviews/data=!4m8!14m7!1m6!2m5!1sChZDSUhNMG9nS0VJQ0FnSUMzdU9QZkpnEAE!2m1!1s0x0:0xc7b3314c4370b7f3!3m1!1s2@1:CIHM0ogKEICAgIC3uOPfJg%7CCgsIgb2ZuQYQ6ODNFA%7C?hl=en,"Restaurante 10/10, el trato buenisimo, es un sitio muy familiar, como los de antes, cercano, la hamburguesa de las regiones super recomendable y de postre, la tarta de queso, la mejor.
Sin duda repetiremos. Además tienen comedor para grupos grandes, celebraremos algo alli sin duda!!"
5,2025-11-01T22:09:59.066Z,augusto gil gomez-lobo,https://www.google.com/maps/reviews/data=!4m8!14m7!1m6!2m5!1sCi9DQUlRQUNvZENodHljRjlvT2t0aWNqSlVOWGRhVjBSUVdUaGpRM2xYZW0xbGQwRRAB!2m1!1s0x0:0xc7b3314c4370b7f3!3m1!1s2@1:CAIQACodChtycF9oOkticjJUNXdaV0RQWThjQ3lXem1ld0E%7C0d0cJr2ymVZ%7C?hl=en,Un crack el amigo Gonzalo
1,2025-11-01T15:56:30.119Z,Dori Muela Bustamante,https://www.google.com/maps/reviews/data=!4m8!14m7!1m6!2m5!1sCi9DQUlRQUNvZENodHljRjlvT20xR1pYaFFjRVo2VWt0Uk4yOVBVVE16WnpCcmFXYxAB!2m1!1s0x0:0xc7b3314c4370b7f3!3m1!1s2@1:CAIQACodChtycF9oOm1GZXhQcEZ6UktRN29PUTMzZzBraWc%7C0d0Xqi66Dn9%7C?hl=en,Muy mala experiencia la comida tardó 2 siglos y sin expectativas altas si puedeis no venir no vengáis. El arroz tieso y recalentado no volvemos más.
1,2025-11-01T15:00:39.550Z,Fran Rubio,https://www.google.com/maps/reviews/data=!4m8!14m7!1m6!2m5!1sCi9DQUlRQUNvZENodHljRjlvT2pCNFVVSnJUR1ZLTmtaMFNHY3hZV3RLVFhaWE1HYxAB!2m1!1s0x0:0xc7b3314c4370b7f3!3m1!1s2@1:CAIQACodChtycF9oOjB4UUJrTGVKNkZ0SGcxYWtKTXZXMGc%7C0d0X1MVmSbr%7C?hl=en,No se puede poner peor valoración las judías DE BOTE el arroz tenía más calentones que la leche lo único medio decente la ensalada y casi ni eso 1h y 20 esperando para comer (somos 6 personas) y de postre malas caras por parte del camarero (el mayor) NO VOLVERÍA NI PARA EL CAFÉ NO VENGÁIS SI NO QUEREIS LLEVAROS LA SORPRESA.
4,2025-10-26T12:23:55.422Z,Raul Gonzalez,https://www.google.com/maps/reviews/data=!4m8!14m7!1m6!2m5!1sCi9DQUlRQUNvZENodHljRjlvT2xWa1R6TnpkbUphUzJseE0yUlpabVJLVFZaU1NYYxAB!2m1!1s0x0:0xc7b3314c4370b7f3!3m1!1s2@1:CAIQACodChtycF9oOlVkTzNzdmJaS2lxM2RZZmRKTVZSSXc%7C0czWAQOAxyO%7C?hl=en,"Estuvimos mi pareja y yo fuimos a comer un trato agradable de parte del dueño y muy divertido,fuimos también a cenar y cenamos muy bien todo estuvo muy rico recomendable ir ,volveremos a ir cuando estemos por allí quedamos muy satisfechos"
4,2025-10-14T10:09:03.465Z,Javier Bazataquí,https://www.google.com/maps/reviews/data=!4m8!14m7!1m6!2m5!1sCi9DQUlRQUNvZENodHljRjlvT2taSU5uaDNkMUZsYjJsalJqbFlhM0l5V0ZCeVNGRRAB!2m1!1s0x0:0xc7b3314c4370b7f3!3m1!1s2@1:CAIQACodChtycF9oOkZINnh3d1Flb2ljRjlYa3IyWFBySFE%7C0cvX3zQiDZt%7C?hl=en,
5,2025-10-13T19:15:02.772Z,Javier,https://www.google.com/maps/reviews/data=!4m8!14m7!1m6!2m5!1sCi9DQUlRQUNvZENodHljRjlvT2pOMFdtUmFlWE5RWjJRNFF6VnJRbFY1YlZkUFZIYxAB!2m1!1s0x0:0xc7b3314c4370b7f3!3m1!1s2@1:CAIQACodChtycF9oOjN0WmRaeXNQZ2Q4QzVrQlV5bVdPVHc%7C0cvJyqi0kxv%7C?hl=en,Buena comida y mejor atencion
3,2025-09-17T15:33:01.557Z,M,https://www.google.com/maps/reviews/data=!4m8!14m7!1m6!2m5!1sChZDSUhNMG9nS0VJQ0FnSUNxMnV1cVFBEAE!2m1!1s0x0:0xc7b3314c4370b7f3!3m1!1s2@1:CIHM0ogKEICAgICq2uuqQA%7CCgwI2PLkhQYQuI2t9wI%7C?hl=en,
5,2025-09-08T19:46:47.454Z,Alicia P. L.,https://www.google.com/maps/reviews/data=!4m8!14m7!1m6!2m5!1sCi9DQUlRQUNvZENodHljRjlvT2tOS2VFOUNhVnBoVjBkdVVUTlBUMUJZVW1wRVMxRRAB!2m1!1s0x0:0xc7b3314c4370b7f3!3m1!1s2@1:CAIQACodChtycF9oOkNKeE9CaVphV0duUTNPT1BYUmpES1E%7C0cjn9bQ3zf8%7C?hl=en,Hemos celebrado una comida de familia en restaurante Las Regiones y estamos muy contentos. Tanto la comida como el servicio ha sido de 10. El restaurante es amplio y está bien cuidado. Nuestro camarero muy simpático y atento. La comida muy buena. He de destacar el risoto de arroz negro que estaba expectacular.
5,2025-09-08T14:55:28.586Z,miguel angel Villahermosa,https://www.google.com/maps/reviews/data=!4m8!14m7!1m6!2m5!1sCi9DQUlRQUNvZENodHljRjlvT21ObWNXZERSbkl0UjJWTk1IVnNla1IzUW5jeFVVRRAB!2m1!1s0x0:0xc7b3314c4370b7f3!3m1!1s2@1:CAIQACodChtycF9oOmNmcWdDRnItR2VNMHVsekR3QncxUUE%7C0cjitVXxpE_%7C?hl=en,
5,2025-08-14T20:31:04.406Z,patricia gº-Navas iniesta,https://www.google.com/maps/reviews/data=!4m8!14m7!1m6!2m5!1sCi9DQUlRQUNvZENodHljRjlvT2xaUlRqWnJSelJsVVdGSGVsVXpSbTVNUzBaSlNGRRAB!2m1!1s0x0:0xc7b3314c4370b7f3!3m1!1s2@1:CAIQACodChtycF9oOlZRTjZrRzRlUWFHelUzRm5MS0ZJSFE%7C0cbZT7NECTI%7C?hl=en,Espectacular. Buenísima relacion calidad precio. Terraza enorme. Me dejaron pasar con mi mascota a la terraza. Sin duda repetiré 100%.
4,2025-08-07T13:27:34.571Z,alberto gorchs,https://www.google.com/maps/reviews/data=!4m8!14m7!1m6!2m5!1sCi9DQUlRQUNvZENodHljRjlvT2tkUWVVSmtNVVZOY1UxMVFVY3RRMjE2UWxKUWJHYxAB!2m1!1s0x0:0xc7b3314c4370b7f3!3m1!1s2@1:CAIQACodChtycF9oOkdQeUJkMUVNcU11QUctQ216QlJQbGc%7C0c_9b5X3VY6%7C?hl=en,Menú normal . Sin mas . Ambiente de trabajadores
5,2025-06-27T23:14:33.874Z,Jose Arias,https://www.google.com/maps/reviews/data=!4m8!14m7!1m6!2m5!1sCi9DQUlRQUNvZENodHljRjlvT2xOcGVFSlVZakpzWXpsVWRIVmpiVEJFUWpaS1ZrRRAB!2m1!1s0x0:0xc7b3314c4370b7f3!3m1!1s2@1:CAIQACodChtycF9oOlNpeEJUYjJsYzlUdHVjbTBEQjZKVkE%7C0cMmMOo818N%7C?hl=en,
4,2025-05-30T12:51:00.320Z,Antonio V,https://www.google.com/maps/reviews/data=!4m8!14m7!1m6!2m5!1sChZDSUhNMG9nS0VLRDRzYXowdlAzYWRnEAE!2m1!1s0x0:0xc7b3314c4370b7f3!3m1!1s2@1:CIHM0ogKEKD4saz0vP3adg%7CCgwItNPmwQYQiJaFmQE%7C?hl=en,Buena atención y la comida bastante buena calidad precio.
3,2025-03-19T06:56:42.969Z,Angel Romero Garcia,https://www.google.com/maps/reviews/data=!4m8!14m7!1m6!2m5!1sChZDSUhNMG9nS0VJQ0FnTUN3Z1k3bldnEAE!2m1!1s0x0:0xc7b3314c4370b7f3!3m1!1s2@1:CIHM0ogKEICAgMCwgY7nWg%7CCgwIqtXpvgYQ0MGOzgM%7C?hl=en,
4,2025-03-02T14:28:26.728Z,Mari Carmen Ares Gomez,https://www.google.com/maps/reviews/data=!4m8!14m7!1m6!2m5!1sChdDSUhNMG9nS0VJQ0FnTUNRek02MmdRRRAB!2m1!1s0x0:0xc7b3314c4370b7f3!3m1!1s2@1:CIHM0ogKEICAgMCQzM62gQE%7CCgwIitaRvgYQoM2b2wI%7C?hl=en,"Pedimos sopa castellana  de primero y buenísima, aunque para mí gusto un poco espesa,   pero  el camarero, Rafa,  muy amable, no dudo en echarme más caldo."
5,2025-02-18T21:15:16.390Z,Inés Camacho,https://www.google.com/maps/reviews/data=!4m8!14m7!1m6!2m5!1sChdDSUhNMG9nS0VJQ0FnTUNnbWEyejNRRRAB!2m1!1s0x0:0xc7b3314c4370b7f3!3m1!1s2@1:CIHM0ogKEICAgMCgma2z3QE%7CCgwI5PDTvQYQ6LS0ugE%7C?hl=en,"Todo estaba riquísimo la atención muy buena, recomiendo mucho comida excelente!!"
4,2025-02-09T17:49:49.066Z,Tony Rodrigo Romero,https://www.google.com/maps/reviews/data=!4m8!14m7!1m6!2m5!1sChZDSUhNMG9nS0VJQ0FnTURBNGJ2Uk1BEAE!2m1!1s0x0:0xc7b3314c4370b7f3!3m1!1s2@1:CIHM0ogKEICAgMDA4bvRMA%7CCgsIvdWjvQYQ6OvSHw%7C?hl=en,"Me ha gustado bastante, comida regional muy rica."
4,2025-01-14T14:50:44.831Z,Victor Octavio,https://www.google.com/maps/reviews/data=!4m8!14m7!1m6!2m5!1sChdDSUhNMG9nS0VJQ0FnSUNYbmFiUHV3RRAB!2m1!1s0x0:0xc7b3314c4370b7f3!3m1!1s2@1:CIHM0ogKEICAgICXnabPuwE%7CCgwIxPOZvAYQ2LO_jAM%7C?hl=en,
5,2024-11-17T16:10:34.326Z,DAVID GARCIA LOPEZ,https://www.google.com/maps/reviews/data=!4m8!14m7!1m6!2m5!1sChdDSUhNMG9nS0VJQ0FnSUQzemMtRy1nRRAB!2m1!1s0x0:0xc7b3314c4370b7f3!3m1!1s2@1:CIHM0ogKEICAgID3zc-G-gE%7CCgwI-qrouQYQiMnrmwE%7C?hl=en,
5,2024-11-02T17:13:59.270Z,AsierVII,https://www.google.com/maps/reviews/data=!4m8!14m7!1m6!2m5!1sChZDSUhNMG9nS0VJQ0FnSUMzdVAyRlZ3EAE!2m1!1s0x0:0xc7b3314c4370b7f3!3m1!1s2@1:CIHM0ogKEICAgIC3uP2FVw%7CCgwI17uZuQYQoNGNgQE%7C?hl=en,"Comida de toda la vida, bien hecha y un trato estupendo, muy bien para ir con los niños y la familia (si tienes)"
5,2024-10-19T07:27:07.311Z,David Carpio,https://www.google.com/maps/reviews/data=!4m8!14m7!1m6!2m5!1sChdDSUhNMG9nS0VJQ0FnSUNYamFhSXVRRRAB!2m1!1s0x0:0xc7b3314c4370b7f3!3m1!1s2@1:CIHM0ogKEICAgICXjaaIuQE%7CCgwIy77NuAYQkJ7IlAE%7C?hl=en,Buen restaurante se come muy bien
5,2024-10-18T18:11:03.045Z,Orlando Lopez Ruiz,https://www.google.com/maps/reviews/data=!4m8!14m7!1m6!2m5!1sChZDSUhNMG9nS0VJQ0FnSUNYcGVxeFN3EAE!2m1!1s0x0:0xc7b3314c4370b7f3!3m1!1s2@1:CIHM0ogKEICAgICXpeqxSw%7CCgsIt8nKuAYQ0ILsFQ%7C?hl=en,
5,2024-10-18T18:09:38.821Z,Dorina Livia Florea,https://www.google.com/maps/reviews/data=!4m8!14m7!1m6!2m5!1sChdDSUhNMG9nS0VJQ0FnSUNYcGNybjFBRRAB!2m1!1s0x0:0xc7b3314c4370b7f3!3m1!1s2@1:CIHM0ogKEICAgICXpcrn1AE%7CCgwI4sjKuAYQgKPrhwM%7C?hl=en,
5,2024-09-15T13:12:52.182Z,Alba Martínez Manzaneque,https://www.google.com/maps/reviews/data=!4m8!14m7!1m6!2m5!1sChZDSUhNMG9nS0VJQ0FnSURINW9hYUlBEAE!2m1!1s0x0:0xc7b3314c4370b7f3!3m1!1s2@1:CIHM0ogKEICAgIDH5oaaIA%7CCgsI1LqbtwYQuJ-cVw%7C?hl=en,
5,2024-09-06T06:00:07.839Z,Arturo Blanco Muñoz,https://www.google.com/maps/reviews/data=!4m8!14m7!1m6!2m5!1sChdDSUhNMG9nS0VJQ0FnSUNIaWVtVjFnRRAB!2m1!1s0x0:0xc7b3314c4370b7f3!3m1!1s2@1:CIHM0ogKEICAgICHiemV1gE%7CCgwI57TqtgYQ0Ia1kAM%7C?hl=en,
5,2024-09-05T21:22:21.453Z,Ivan Martínez Vañó,https://www.google.com/maps/reviews/data=!4m8!14m7!1m6!2m5!1sChZDSUhNMG9nS0VJQ0FnSUNIa2NMTVRREAE!2m1!1s0x0:0xc7b3314c4370b7f3!3m1!1s2@1:CIHM0ogKEICAgICHkcLMTQ%7CCgwIjcLotgYQsJiv2AE%7C?hl=en,"Casero y familiar, Rafa es un hombre encantador, la comida muy buena y a un buen precio. Las croquetas en particular estaban muy buenas y el brownie estaba muy bueno también. Recomendable 👌🏻."
4,2024-09-04T22:37:54.214Z,Alf Fdez,https://www.google.com/maps/reviews/data=!4m8!14m7!1m6!2m5!1sChdDSUhNMG9nS0VJQ0FnSUNIOXEzLXdnRRAB!2m1!1s0x0:0xc7b3314c4370b7f3!3m1!1s2@1:CIHM0ogKEICAgICH9q3-wgE%7CCgsIwsLjtgYQyMKnZg%7C?hl=en,
5,2024-08-03T22:34:40.592Z,Sheylaandrea Leon Romero,https://www.google.com/maps/reviews/data=!4m8!14m7!1m6!2m5!1sChZDSUhNMG9nS0VJQ0FnSURiOHJyM1JREAE!2m1!1s0x0:0xc7b3314c4370b7f3!3m1!1s2@1:CIHM0ogKEICAgIDb8rr3RQ%7CCgwIgOG6tQYQ2KnLmgI%7C?hl=en,
5,2024-07-11T17:39:13.450Z,Candido Parra Benito,https://www.google.com/maps/reviews/data=!4m8!14m7!1m6!2m5!1sChdDSUhNMG9nS0VJQ0FnSUNyaDhIY2t3RRAB!2m1!1s0x0:0xc7b3314c4370b7f3!3m1!1s2@1:CIHM0ogKEICAgICrh8HckwE%7CCgwIwbHAtAYQuLjh1gE%7C?hl=en,
5,2024-07-05T12:47:22.607Z,Jose Manuel Delgado Ruiz,https://www.google.com/maps/reviews/data=!4m8!14m7!1m6!2m5!1sChdDSUhNMG9nS0VJQ0FnSUNya3VHdDJ3RRAB!2m1!1s0x0:0xc7b3314c4370b7f3!3m1!1s2@1:CIHM0ogKEICAgICrkuGt2wE%7CCgwI2taftAYQuO7ooQI%7C?hl=en,
4,2024-07-02T18:35:01.441Z,Miguel Angel Gomez Peligros,https://www.google.com/maps/reviews/data=!4m8!14m7!1m6!2m5!1sChdDSUhNMG9nS0VJQ0FnSURMMy1PMHF3RRAB!2m1!1s0x0:0xc7b3314c4370b7f3!3m1!1s2@1:CIHM0ogKEICAgIDL3-O0qwE%7CCgwI1ZCRtAYQuMW_0gE%7C?hl=en,
4,2024-06-30T14:43:32.348Z,Francisco Mendoza Paniagua,https://www.google.com/maps/reviews/data=!4m8!14m7!1m6!2m5!1sChZDSUhNMG9nS0VJQ0FnSURMMDRMWFJ3EAE!2m1!1s0x0:0xc7b3314c4370b7f3!3m1!1s2@1:CIHM0ogKEICAgIDL04LXRw%7CCgwIlN6FtAYQiL_6pQE%7C?hl=en,
4,2024-06-15T21:17:53.743Z,Pedro Angel Campo Huertas,https://www.google.com/maps/reviews/data=!4m8!14m7!1m6!2m5!1sChZDSUhNMG9nS0VJQ0FnSUNMdEstYWNREAE!2m1!1s0x0:0xc7b3314c4370b7f3!3m1!1s2@1:CIHM0ogKEICAgICLtK-acQ%7CCgwIgYq4swYQiMHg4gI%7C?hl=en,
5,2024-05-30T20:19:27.470Z,Roman,https://www.google.com/maps/reviews/data=!4m8!14m7!1m6!2m5!1sChZDSUhNMG9nS0VJQ0FnSUN6LU1PQU9BEAE!2m1!1s0x0:0xc7b3314c4370b7f3!3m1!1s2@1:CIHM0ogKEICAgICz-MOAOA%7CCgwIz77jsgYQ8IKz4AE%7C?hl=en,Muy atentos y muy rico todo
5,2024-05-27T20:42:11.511Z,Evaristo Roldán,https://www.google.com/maps/reviews/data=!4m8!14m7!1m6!2m5!1sChdDSUhNMG9nS0VJQ0FnSURUaTREMjl3RRAB!2m1!1s0x0:0xc7b3314c4370b7f3!3m1!1s2@1:CIHM0ogKEICAgIDTi4D29wE%7CCgwIo-DTsgYQyLn38wE%7C?hl=en,
5,2024-04-04T14:10:04.314Z,carlos gonzalez,https://www.google.com/maps/reviews/data=!4m8!14m7!1m6!2m5!1sChdDSUhNMG9nS0VJQ0FnSUREME9qRTBBRRAB!2m1!1s0x0:0xc7b3314c4370b7f3!3m1!1s2@1:CIHM0ogKEICAgIDD0OjE0AE%7CCgwIvOm6sAYQ8IDulQE%7C?hl=en,"Muy simpaticos en el bar
Comida tipica, platos combinados. Bocadillos, menú del día muy buena
Perfecto para una parada en el camino o ir a comer sin buscar gastarte demasiado"
4,2024-04-01T13:58:39.724Z,Jose Luis Aranda Platero,https://www.google.com/maps/reviews/data=!4m8!14m7!1m6!2m5!1sChZDSUhNMG9nS0VJQ0FnSUNEaTdTQVBREAE!2m1!1s0x0:0xc7b3314c4370b7f3!3m1!1s2@1:CIHM0ogKEICAgICDi7SAPQ%7CCgwIj_uqsAYQ6Jqq2QI%7C?hl=en,Buen lugar para comer menú del día
3,2024-03-29T14:59:28.677Z,ROCIO ARIAS,https://www.google.com/maps/reviews/data=!4m8!14m7!1m6!2m5!1sChZDSUhNMG9nS0VJQ0FnSUNEc1ltYllnEAE!2m1!1s0x0:0xc7b3314c4370b7f3!3m1!1s2@1:CIHM0ogKEICAgICDsYmbYg%7CCgwI0K6bsAYQiMKWwwI%7C?hl=en,
5,2024-03-29T14:20:46.137Z,Natalia Charnetskaya,https://www.google.com/maps/reviews/data=!4m8!14m7!1m6!2m5!1sChdDSUhNMG9nS0VJQ0FnSUNEc1lMVXF3RRAB!2m1!1s0x0:0xc7b3314c4370b7f3!3m1!1s2@1:CIHM0ogKEICAgICDsYLUqwE%7CCgsIvpybsAYQ6IPiQQ%7C?hl=en,
4,2024-03-26T12:14:46.508Z,Fernando Cano,https://www.google.com/maps/reviews/data=!4m8!14m7!1m6!2m5!1sChZDSUhNMG9nS0VJQ0FnSUNEMHRmR1ZREAE!2m1!1s0x0:0xc7b3314c4370b7f3!3m1!1s2@1:CIHM0ogKEICAgICD0tfGVQ%7CCgwItviKsAYQ0Oik8gE%7C?hl=en,
5,2024-03-25T09:08:16.716Z,D. Suarez,https://www.google.com/maps/reviews/data=!4m8!14m7!1m6!2m5!1sChZDSUhNMG9nS0VJQ0FnSUNEektQUldnEAE!2m1!1s0x0:0xc7b3314c4370b7f3!3m1!1s2@1:CIHM0ogKEICAgICDzKPRWg%7CCgwIgP6EsAYQyM3u1QI%7C?hl=en,Buena relación calidad precio. El servicio es excelente.
5,2024-03-06T20:53:07.685Z,Felix Pozuelo,https://www.google.com/maps/reviews/data=!4m8!14m7!1m6!2m5!1sChdDSUhNMG9nS0VJQ0FnSURvLUlLem13RRAB!2m1!1s0x0:0xc7b3314c4370b7f3!3m1!1s2@1:CIHM0ogKEICAgIDo-IKzmwE%7CCgwIs6-jrwYQgLHZxgI%7C?hl=en,Se come bien y barato.
4,2024-02-19T20:48:25.990Z,Luis Miguel,https://www.google.com/maps/reviews/data=!4m8!14m7!1m6!2m5!1sChZDSUhNMG9nS0VJQ0FnSUNkdjVtUVdREAE!2m1!1s0x0:0xc7b3314c4370b7f3!3m1!1s2@1:CIHM0ogKEICAgICdv5mQWQ%7CCgwImf3OrgYQiKKs2AM%7C?hl=en,Buena calidad precio
4,2023-12-26T15:02:28.350Z,21RaúlNicolás,https://www.google.com/maps/reviews/data=!4m8!14m7!1m6!2m5!1sChdDSUhNMG9nS0VJQ0FnSUMxa3VyR2lRRRAB!2m1!1s0x0:0xc7b3314c4370b7f3!3m1!1s2@1:CIHM0ogKEICAgIC1kurGiQE%7CCgwIhNarrAYQ8PKSpwE%7C?hl=en,
4,2023-12-24T08:14:23.282Z,FRANCISCO FRESNEDA,https://www.google.com/maps/reviews/data=!4m8!14m7!1m6!2m5!1sChZDSUhNMG9nS0VJQ0FnSURweUphd0FnEAE!2m1!1s0x0:0xc7b3314c4370b7f3!3m1!1s2@1:CIHM0ogKEICAgIDpyJawAg%7CCgwI39CfrAYQ0ObFhgE%7C?hl=en,Buen servicio y buena atención
5,2023-12-10T19:59:29.429Z,Jorge Gallego Gallego,https://www.google.com/maps/reviews/data=!4m8!14m7!1m6!2m5!1sChZDSUhNMG9nS0VJQ0FnSURWbUs3NldnEAE!2m1!1s0x0:0xc7b3314c4370b7f3!3m1!1s2@1:CIHM0ogKEICAgIDVmK76Wg%7CCgwIobHYqwYQsLvxzAE%7C?hl=en,"Genial para degustar un buen menú o unas buenas tapas. La atención muy buena, buen servicio y buen género."
5,2023-12-09T12:59:31.672Z,Jose Luis Muñoz Diaz,https://www.google.com/maps/reviews/data=!4m8!14m7!1m6!2m5!1sChdDSUhNMG9nS0VJQ0FnSUNWMjdxQ19BRRAB!2m1!1s0x0:0xc7b3314c4370b7f3!3m1!1s2@1:CIHM0ogKEICAgICV27qC_AE%7CCgwIs8nRqwYQkI7nwAI%7C?hl=en,
5,2023-10-11T13:53:50.288Z,NOELIA,https://www.google.com/maps/reviews/data=!4m8!14m7!1m6!2m5!1sChdDSUhNMG9nS0VJQ0FnSUM1akp1UDBnRRAB!2m1!1s0x0:0xc7b3314c4370b7f3!3m1!1s2@1:CIHM0ogKEICAgIC5jJuP0gE%7CCgwI7tGaqQYQ6IWwiQE%7C?hl=en,"Hemos estado allí hoy ,tienen menú de comida tradicional y platos copiosos ,todo muy rico y la gente muy amable"
4,2023-09-17T08:55:32.028Z,Paco,https://www.google.com/maps/reviews/data=!4m8!14m7!1m6!2m5!1sChdDSUhNMG9nS0VJQ0FnSUNaNC12Yml3RRAB!2m1!1s0x0:0xc7b3314c4370b7f3!3m1!1s2@1:CIHM0ogKEICAgICZ4-vbiwE%7CCgsIhP6aqAYQ-NvUDQ%7C?hl=en,"Cenamos ayer con unos amigos,  buen servicio,  simpatía y calidad."
5,2023-09-16T09:04:42.137Z,tata loto,https://www.google.com/maps/reviews/data=!4m8!14m7!1m6!2m5!1sChdDSUhNMG9nS0VJQ0FnSUNaM1lPUnlnRRAB!2m1!1s0x0:0xc7b3314c4370b7f3!3m1!1s2@1:CIHM0ogKEICAgICZ3YORygE%7CCgsIqt-VqAYQqObWQQ%7C?hl=en,
4,2023-09-04T11:12:03.232Z,Jose Aleman,https://www.google.com/maps/reviews/data=!4m8!14m7!1m6!2m5!1sChZDSUhNMG9nS0VJQ0FnSUNaeFBUbWZ3EAE!2m1!1s0x0:0xc7b3314c4370b7f3!3m1!1s2@1:CIHM0ogKEICAgICZxPTmfw%7CCgsIg_fWpwYQsPLVbg%7C?hl=en,"Se merece una reseña por el magnífico servicio que nos dieron. Íbamos de viaje, teníamos prisa y llegamos a la vez que una mesa enorme. Les dijimos que si nos iba a tomar nota después que a ellos no nos daba tiempo a comer y nos dieron prioridad en la cocina. Menú del día más que aceptable. Un buen lugar de parada para los que vamos en ruta por la zona. Eso sí, muchísimo ruido en el comedor."
4,2023-09-03T14:59:51.048Z,Pablo conventos,https://www.google.com/maps/reviews/data=!4m8!14m7!1m6!2m5!1sChZDSUhNMG9nS0VJQ0FnSUNabU5LdGZnEAE!2m1!1s0x0:0xc7b3314c4370b7f3!3m1!1s2@1:CIHM0ogKEICAgICZmNKtfg%7CCgsI577SpwYQ8M-tFw%7C?hl=en,
5,2023-09-02T21:59:28.553Z,Carlos José Zamorano Rodriguez,https://www.google.com/maps/reviews/data=!4m8!14m7!1m6!2m5!1sChZDSUhNMG9nS0VJQ0FnSURnamZuR0pREAE!2m1!1s0x0:0xc7b3314c4370b7f3!3m1!1s2@1:CIHM0ogKEICAgIDgjfnGJQ%7CCgwIwODOpwYQ8KqBiAI%7C?hl=en,Un lugar perfecto para cenar con la familia. Antes había un castillo hinchable pero ahora ya no. 👍
5,2023-08-31T14:52:03.953Z,Jessica Gabernet,https://www.google.com/maps/reviews/data=!4m8!14m7!1m6!2m5!1sChZDSUhNMG9nS0VJQ0FnSURwel9peGR3EAE!2m1!1s0x0:0xc7b3314c4370b7f3!3m1!1s2@1:CIHM0ogKEICAgIDpz_ixdw%7CCgwIk9LCpwYQ-NG4xgM%7C?hl=en,"La verdad que fue de pasada camino a murcia pero comimos muy bien, las hamburguesas especiales k pedimos estaban bienisimas, la carne casera y muy buenas, tuvimos un pequeño percance al principio pk nos llevaron al comedor y allí no se comían ni bocadillos ni hamburguesas y tuvimos k salir a la zona del café y al hombre no le hizo gracia pero luego fue muy atento gracias, lo recomiendo."
5,2023-08-17T18:31:16.173Z,Daniel Román Cano,https://www.google.com/maps/reviews/data=!4m8!14m7!1m6!2m5!1sChZDSUhNMG9nS0VJQ0FnSURwN08yOGZ3EAE!2m1!1s0x0:0xc7b3314c4370b7f3!3m1!1s2@1:CIHM0ogKEICAgIDp7O28fw%7CCgsI9M75pgYQyNfcUg%7C?hl=en,
1,2023-08-07T09:38:09.069Z,N L,https://www.google.com/maps/reviews/data=!4m8!14m7!1m6!2m5!1sChdDSUhNMG9nS0VJQ0FnSUNwcGZqV3dBRRAB!2m1!1s0x0:0xc7b3314c4370b7f3!3m1!1s2@1:CIHM0ogKEICAgICppfjWwAE%7CCgsIgffCpgYQsLesIQ%7C?hl=en,"El dueño da muy malas contestaciones, no lo recomiendo"
5,2023-07-29T10:18:37.280Z,Alberto B,https://www.google.com/maps/reviews/data=!4m8!14m7!1m6!2m5!1sChZDSUhNMG9nS0VJQ0FnSUNwbExuaUtREAE!2m1!1s0x0:0xc7b3314c4370b7f3!3m1!1s2@1:CIHM0ogKEICAgICplLniKQ%7CCgwI_c6TpgYQgO7qhQE%7C?hl=en,"Sitio familiar y buena comida casera
Mucho mejor q otros sitios cercanos q se creen q tienen cocina de autor o como se llame eso"
5,2023-07-23T20:38:56.141Z,Antonio Ruiz Rueda,https://www.google.com/maps/reviews/data=!4m8!14m7!1m6!2m5!1sChdDSUhNMG9nS0VJQ0FnSUN4aGRQaWhBRRAB!2m1!1s0x0:0xc7b3314c4370b7f3!3m1!1s2@1:CIHM0ogKEICAgICxhdPihAE%7CCgsI4J_2pQYQ8KizQw%7C?hl=en,Los viejos del lugar ( los auténticos)
5,2023-07-23T01:51:17.794Z,Isabel Olmedo Muñoz,https://www.google.com/maps/reviews/data=!4m8!14m7!1m6!2m5!1sChZDSUhNMG9nS0VJQ0FnSURKcTZYVkZBEAE!2m1!1s0x0:0xc7b3314c4370b7f3!3m1!1s2@1:CIHM0ogKEICAgIDJq6XVFA%7CCgwIlY_ypQYQkKeB-wI%7C?hl=en,
5,2023-07-09T06:13:14.419Z,Angel Illescas Vargas,https://www.google.com/maps/reviews/data=!4m8!14m7!1m6!2m5!1sChdDSUhNMG9nS0VJQ0FnSURKa0pPRzR3RRAB!2m1!1s0x0:0xc7b3314c4370b7f3!3m1!1s2@1:CIHM0ogKEICAgIDJkJOG4wE%7CCgwI-p-ppQYQ0IrxxwE%7C?hl=en,
4,2023-07-05T13:20:25.593Z,Lorenzo Porras,https://www.google.com/maps/reviews/data=!4m8!14m7!1m6!2m5!1sChdDSUhNMG9nS0VJQ0FnSUNKbTVHUGxBRRAB!2m1!1s0x0:0xc7b3314c4370b7f3!3m1!1s2@1:CIHM0ogKEICAgICJm5GPlAE%7CCgwImdyVpQYQyO6XmwI%7C?hl=en,
4,2023-06-28T07:29:03.309Z,Jose Villa,https://www.google.com/maps/reviews/data=!4m8!14m7!1m6!2m5!1sChdDSUhNMG9nS0VJQ0FnSUNKdnUzYjJRRRAB!2m1!1s0x0:0xc7b3314c4370b7f3!3m1!1s2@1:CIHM0ogKEICAgICJvu3b2QE%7CCgwIv8LvpAYQqIHSkwE%7C?hl=en,
5,2023-05-28T12:53:32.425Z,Antonia Carrascosa Molina,https://www.google.com/maps/reviews/data=!4m8!14m7!1m6!2m5!1sChdDSUhNMG9nS0VJQ0FnSUN4dF9Ua3pBRRAB!2m1!1s0x0:0xc7b3314c4370b7f3!3m1!1s2@1:CIHM0ogKEICAgICxt_TkzAE%7CCgwIzJ3NowYQuOj1ygE%7C?hl=en,
3,2023-05-18T20:49:03.741Z,Pilar Castellanos,https://www.google.com/maps/reviews/data=!4m8!14m7!1m6!2m5!1sChdDSUhNMG9nS0VJQ0FnSUN4X3NfSXdRRRAB!2m1!1s0x0:0xc7b3314c4370b7f3!3m1!1s2@1:CIHM0ogKEICAgICx_s_IwQE%7CCgwIv56aowYQ-JbX4QI%7C?hl=en,
5,2023-04-29T23:55:28.068Z,locul center,https://www.google.com/maps/reviews/data=!4m8!14m7!1m6!2m5!1sChdDSUhNMG9nS0VJQ0FnSURScGN1cWpBRRAB!2m1!1s0x0:0xc7b3314c4370b7f3!3m1!1s2@1:CIHM0ogKEICAgIDRpcuqjAE%7CCgsI8Ny2ogYQ0ILLIA%7C?hl=en,Comida de calidad a buen precio
5,2023-04-14T09:19:38.855Z,Martin Banegas,https://www.google.com/maps/reviews/data=!4m8!14m7!1m6!2m5!1sChZDSUhNMG9nS0VJQ0FnSUNSMzlHb0p3EAE!2m1!1s0x0:0xc7b3314c4370b7f3!3m1!1s2@1:CIHM0ogKEICAgICR39GoJw%7CCgwIqrXkoQYQkOCUmAM%7C?hl=en,
4,2023-04-11T20:14:48.832Z,David Grande,https://www.google.com/maps/reviews/data=!4m8!14m7!1m6!2m5!1sChZDSUhNMG9nS0VJQ0FnSUNSaDZqVkx3EAE!2m1!1s0x0:0xc7b3314c4370b7f3!3m1!1s2@1:CIHM0ogKEICAgICRh6jVLw%7CCgwIuP_WoQYQwOyCjQM%7C?hl=en,
5,2023-03-26T18:39:57.639Z,Bixo Asekas,https://www.google.com/maps/reviews/data=!4m8!14m7!1m6!2m5!1sChZDSUhNMG9nS0VJQ0FnSUNSako3N1ZnEAE!2m1!1s0x0:0xc7b3314c4370b7f3!3m1!1s2@1:CIHM0ogKEICAgICRjJ77Vg%7CCgwI_aKCoQYQ4K-RsQI%7C?hl=en,Un buen café.
5,2023-02-25T15:08:25.898Z,Carlos Tejado,https://www.google.com/maps/reviews/data=!4m8!14m7!1m6!2m5!1sChZDSUhNMG9nS0VJQ0FnSUNoNzVyd1VREAE!2m1!1s0x0:0xc7b3314c4370b7f3!3m1!1s2@1:CIHM0ogKEICAgICh75rwUQ%7CCgwI6cjonwYQqOTRrAM%7C?hl=en,
4,2023-02-07T00:20:21.922Z,cristina paniagua,https://www.google.com/maps/reviews/data=!4m8!14m7!1m6!2m5!1sChdDSUhNMG9nS0VJQ0FnSUNoek55SmdBRRAB!2m1!1s0x0:0xc7b3314c4370b7f3!3m1!1s2@1:CIHM0ogKEICAgIChzNyJgAE%7CCgwIxbKGnwYQgIXitwM%7C?hl=en,
2,2023-01-22T15:03:10.354Z,Virginia Flores Molina,https://www.google.com/maps/reviews/data=!4m8!14m7!1m6!2m5!1sChdDSUhNMG9nS0VJQ0FnSURCOGNfei13RRAB!2m1!1s0x0:0xc7b3314c4370b7f3!3m1!1s2@1:CIHM0ogKEICAgIDB8c_z-wE%7CCgwIrqC1ngYQiJX_qAE%7C?hl=en,"el jamon asado muy bueno perp el menu de fin de semana ñeh, podrian meterle diferentes cosas."
5,2023-01-11T14:07:21.099Z,Juan Plume,https://www.google.com/maps/reviews/data=!4m8!14m7!1m6!2m5!1sChdDSUhNMG9nS0VJQ0FnSURCaE1ERHZ3RRAB!2m1!1s0x0:0xc7b3314c4370b7f3!3m1!1s2@1:CIHM0ogKEICAgIDBhMDDvwE%7CCgsImYX7nQYQyNWfLw%7C?hl=en,"Buena comida, económica y genial simpatía. 👌"
5,2023-01-09T19:52:08.875Z,Africa Alcolea,https://www.google.com/maps/reviews/data=!4m8!14m7!1m6!2m5!1sChdDSUhNMG9nS0VJQ0FnSURCMExuSDhnRRAB!2m1!1s0x0:0xc7b3314c4370b7f3!3m1!1s2@1:CIHM0ogKEICAgIDB0LnH8gE%7CCgwI6ODxnQYQoNm_oQM%7C?hl=en,"Lo recomiendo, buena comida ,muy limpio y buen servicio"
5,2023-01-03T06:36:27.137Z,Candy Lopez,https://www.google.com/maps/reviews/data=!4m8!14m7!1m6!2m5!1sChdDSUhNMG9nS0VJQ0FnSUNCbzdTeDRnRRAB!2m1!1s0x0:0xc7b3314c4370b7f3!3m1!1s2@1:CIHM0ogKEICAgICBo7Sx4gE%7CCgsI65nPnQYQoP7BQQ%7C?hl=en,
1,2023-01-01T14:41:45.968Z,Ivan Gilabert,https://www.google.com/maps/reviews/data=!4m8!14m7!1m6!2m5!1sChZDSUhNMG9nS0VJQ0FnSUNCcmFTeUFnEAE!2m1!1s0x0:0xc7b3314c4370b7f3!3m1!1s2@1:CIHM0ogKEICAgICBraSyAg%7CCgwIqbfGnQYQgPr2zQM%7C?hl=en,"Imposible unos macarrones peores, comida pésima y servicio horrible"
5,2022-12-11T01:24:06.690Z,José Luis Pérez,https://www.google.com/maps/reviews/data=!4m8!14m7!1m6!2m5!1sChdDSUhNMG9nS0VJQ0FnSUQtaDZxSjBnRRAB!2m1!1s0x0:0xc7b3314c4370b7f3!3m1!1s2@1:CIHM0ogKEICAgID-h6qJ0gE%7CCgwItuLUnAYQuPmWyQI%7C?hl=en,"Restaurante familiar, buena comida y trato agradable."
4,2022-11-01T17:12:14.066Z,Raúl Mazuecos,https://www.google.com/maps/reviews/data=!4m8!14m7!1m6!2m5!1sChZDSUhNMG9nS0VJQ0FnSUMtMnFqTGVnEAE!2m1!1s0x0:0xc7b3314c4370b7f3!3m1!1s2@1:CIHM0ogKEICAgIC-2qjLeg%7CCgsI7qaFmwYQgK7kHw%7C?hl=en,
