rating,published_at,author_name,review_url,text
1,2025-10-30T11:35:19.239Z,,https://www.google.com/maps/search/?api=1&query=Consultorio%20M%C3%A9dico%20De%20Cobisa&query_place_id=ChIJVVVVVcXE9bMR11wjzCMdvnw,"Lo del consultorio médico es irrisorio.
A parte de que la mujer de admisión no coge el teléfono ni con las manos de otro, en ocasiones hasta lo llega a desconectar o silenciar para no escucharlo. Da igual cuanto llames que si te lo coge es una bendita casualidad.

Lamentablemente esto no es lo más grave, sino que, a las 11:30 u 11:20 se van a hacer su descanso de 30 minutos para almorzar (con todo el derecho del mundo) y se van los 5 a la vez dejando esperar a la gente y sin atender a los que llegan hasta que terminan…
Creo que hay que ser muy corto de miras para citar a la gente a estas horas si sabes que estás descansando, por no hablar de que haya dos médicos y dos enfermeros y no se puedan ni turnar para hacer los descansos y así dejar a la gente desatendida.

La realidad es que creo que esto le pasará a mucha más gente, pero no lo dicen."
1,2025-07-29T13:35:08.607Z,,https://www.google.com/maps/search/?api=1&query=Consultorio%20M%C3%A9dico%20De%20Cobisa&query_place_id=ChIJVVVVVcXE9bMR11wjzCMdvnw,"Pongo una estrella pq no se pueden poner menos. La atención deja mucho que desear. Soy de fuera, esta mañana he tenido que ir para que me atendiesen por una urgencia y la recepcionista me ha puesto mil pegas primero me ha dicho que no había médico, luego que el médico se tenía que ir corriendo, que necesitaba hacer un papel de desplazamiento y se tardaba mucho, que me fuese a Toledo a partir de las 15.... En fin, que no tenían ganas de atenderme y sólo había una señora esperando en la consulta. Lamentable."
1,2022-12-13T13:46:36.285Z,,https://www.google.com/maps/search/?api=1&query=Consultorio%20M%C3%A9dico%20De%20Cobisa&query_place_id=ChIJVVVVVcXE9bMR11wjzCMdvnw,"La atención por parte de la doctora Cué es pésima, un día más se ha ido y no ha atendido a los pacientes. Faltan profesionales y sobra soberbia."
3,2022-11-30T07:37:04.858Z,,https://www.google.com/maps/search/?api=1&query=Consultorio%20M%C3%A9dico%20De%20Cobisa&query_place_id=ChIJVVVVVcXE9bMR11wjzCMdvnw,
1,2022-09-16T06:59:40.550Z,,https://www.google.com/maps/search/?api=1&query=Consultorio%20M%C3%A9dico%20De%20Cobisa&query_place_id=ChIJVVVVVcXE9bMR11wjzCMdvnw,"Es una vergüenza la atención al paciente de este centro de salud, no hay médico suplente, porque el titular está de vacaciones, no te dan solucion a ningún problema, te dan cita telefónica para dentro de casi un mes, y presencial para más de 20 días, una vergüenza que no merecemos los habitantes de Cobisa, como hay libre elección de médico deberíamos de cambiarnos todos para que el Sescam se dé cuenta de lo que pasa en este centro de salud, una vergüenza!!!!!"
1,2022-09-09T09:15:18.167Z,,https://www.google.com/maps/search/?api=1&query=Consultorio%20M%C3%A9dico%20De%20Cobisa&query_place_id=ChIJVVVVVcXE9bMR11wjzCMdvnw,"Cada día peor, no hay médico suplentes, y estan dando  cita para un mes después"
1,2022-08-22T10:15:44.093Z,,https://www.google.com/maps/search/?api=1&query=Consultorio%20M%C3%A9dico%20De%20Cobisa&query_place_id=ChIJVVVVVcXE9bMR11wjzCMdvnw,"No corresponde con la realidad, es el consultorio antiguo. El nuevo está en otra dirección."
1,2021-08-09T11:04:16.224Z,,https://www.google.com/maps/search/?api=1&query=Consultorio%20M%C3%A9dico%20De%20Cobisa&query_place_id=ChIJVVVVVcXE9bMR11wjzCMdvnw,Es imposible contactar por teléfono.
5,2021-03-24T13:06:53.699Z,,https://www.google.com/maps/search/?api=1&query=Consultorio%20M%C3%A9dico%20De%20Cobisa&query_place_id=ChIJVVVVVcXE9bMR11wjzCMdvnw,
