rating,published_at,author_name,review_url,text
5,2023-05-25T21:03:23.581Z,Gemma Rosillo,https://www.google.com/maps/reviews/data=!4m8!14m7!1m6!2m5!1sChdDSUhNMG9nS0VJQ0FnSUNPeEt1eXFRRRAB!2m1!1s0x0:0x8f7d01d87fefd64b!3m1!1s2@1:CIHM0ogKEICAgICOxKuyqQE%7CCgwIm5q_owYQ4ISglQI%7C?hl=en,Lugar acogedor y confortable. Comida buenísima y música siempre agradable. Aperol 😋
5,2023-05-12T08:45:45.653Z,María Victoria Aroca,https://www.google.com/maps/reviews/data=!4m8!14m7!1m6!2m5!1sChdDSUhNMG9nS0VJQ0FnSUN4cklpTWlBRRAB!2m1!1s0x0:0x8f7d01d87fefd64b!3m1!1s2@1:CIHM0ogKEICAgICxrIiMiAE%7CCgwIufn3ogYQqMDFtwI%7C?hl=en,Es un sitio de excelente calidad y con un servicio muy bueno que te hacen recomendaciones muy acertadas.
5,2023-05-05T21:32:52.765Z,Olga Cantarero,https://www.google.com/maps/reviews/data=!4m8!14m7!1m6!2m5!1sChdDSUhNMG9nS0VJQ0FnSURSMTg2UTRBRRAB!2m1!1s0x0:0x8f7d01d87fefd64b!3m1!1s2@1:CIHM0ogKEICAgIDR186Q4AE%7CCgwIhOzVogYQkOrr7AI%7C?hl=en,
5,2023-04-30T22:11:22.249Z,manolo romero maroto,https://www.google.com/maps/reviews/data=!4m8!14m7!1m6!2m5!1sChZDSUhNMG9nS0VJQ0FnSURSamVDeEVnEAE!2m1!1s0x0:0x8f7d01d87fefd64b!3m1!1s2@1:CIHM0ogKEICAgIDRjeCxEg%7CCgsIis-7ogYQuNz7dg%7C?hl=en,"El trato muy bueno y las pizzas, buenisimas"
5,2023-04-19T07:41:54.761Z,Oscar Casado,https://www.google.com/maps/reviews/data=!4m8!14m7!1m6!2m5!1sChdDSUhNMG9nS0VJQ0FnSURSak9EWGhBRRAB!2m1!1s0x0:0x8f7d01d87fefd64b!3m1!1s2@1:CIHM0ogKEICAgIDRjODXhAE%7CCgwIwrb-oQYQ0Kvx6gI%7C?hl=en,"No he comido nunca, pero se ve bien."
5,2023-04-11T11:14:27.768Z,Pablo Chamorro,https://www.google.com/maps/reviews/data=!4m8!14m7!1m6!2m5!1sChZDSUhNMG9nS0VJQ0FnSUNSbTYtLU9nEAE!2m1!1s0x0:0x8f7d01d87fefd64b!3m1!1s2@1:CIHM0ogKEICAgICRm6--Og%7CCgwIk4LVoQYQ0Km87gI%7C?hl=en,
5,2023-04-06T21:03:12.629Z,Johanna Diaz,https://www.google.com/maps/reviews/data=!4m8!14m7!1m6!2m5!1sChZDSUhNMG9nS0VJQ0FnSUNSNWR1dVd3EAE!2m1!1s0x0:0x8f7d01d87fefd64b!3m1!1s2@1:CIHM0ogKEICAgICR5duuWw%7CCgwIkOe8oQYQ6LmArAI%7C?hl=en,Buen sitio y la comida exquisita!! Volvería seguro!!
5,2023-03-26T17:01:20.036Z,Arquetra Consultores Arqueología Profesional,https://www.google.com/maps/reviews/data=!4m8!14m7!1m6!2m5!1sChZDSUhNMG9nS0VJQ0FnSUNSOUpmNU9BEAE!2m1!1s0x0:0x8f7d01d87fefd64b!3m1!1s2@1:CIHM0ogKEICAgICR9Jf5OA%7CCgsI4PSBoQYQgPiiEQ%7C?hl=en,La comida increíble y el personal genial. Repetiremos seguro. Más que recomendable
5,2023-03-18T20:57:06.605Z,David García Resino,https://www.google.com/maps/reviews/data=!4m8!14m7!1m6!2m5!1sChdDSUhNMG9nS0VJQ0FnSURodV8yTHRBRRAB!2m1!1s0x0:0x8f7d01d87fefd64b!3m1!1s2@1:CIHM0ogKEICAgIDhu_2LtAE%7CCgwIosvYoAYQ2LTfoAI%7C?hl=en,Muy buenas las pizzas y tardaron poquito
5,2023-03-04T15:02:28.070Z,Nano Alonso,https://www.google.com/maps/reviews/data=!4m8!14m7!1m6!2m5!1sChdDSUhNMG9nS0VJQ0FnSURoZ292YWx3RRAB!2m1!1s0x0:0x8f7d01d87fefd64b!3m1!1s2@1:CIHM0ogKEICAgIDhgovalwE%7CCgsIhLuNoAYQsPLCIQ%7C?hl=en,"La mejor Pizza que he probado en mi vida. ( “Pizza”, lo escribo en mayúscula, porque así se lo merece)."
5,2023-03-04T11:08:30.436Z,Al Good,https://www.google.com/maps/reviews/data=!4m8!14m7!1m6!2m5!1sChZDSUhNMG9nS0VJQ0FnSURoX0pQRE93EAE!2m1!1s0x0:0x8f7d01d87fefd64b!3m1!1s2@1:CIHM0ogKEICAgIDh_JPDOw%7CCgwIrs2MoAYQ4LOP0AE%7C?hl=en,
5,2023-02-17T19:13:27.041Z,Isabel Lopez-Brea Zarza,https://www.google.com/maps/reviews/data=!4m8!14m7!1m6!2m5!1sChZDSUhNMG9nS0VJQ0FnSUNoeGZlaVNBEAE!2m1!1s0x0:0x8f7d01d87fefd64b!3m1!1s2@1:CIHM0ogKEICAgIChxfeiSA%7CCgsI16O_nwYQkKz5Ew%7C?hl=en,"Todo buenísimo!!!
Muy buena mezcla de sabores.
Buen servicio .
Lo recomiendo"
5,2023-02-17T11:28:42.474Z,jesus santos calcerrada,https://www.google.com/maps/reviews/data=!4m8!14m7!1m6!2m5!1sChdDSUhNMG9nS0VJQ0FnSUNoLWEzRTRBRRAB!2m1!1s0x0:0x8f7d01d87fefd64b!3m1!1s2@1:CIHM0ogKEICAgICh-a3E4AE%7CCgwI6sm9nwYQ4Kuv4gE%7C?hl=en,"Las mejores pizzas que he comido sin duda alguna.
De verdad, si os gusta la pizza de la de verdad, id a probar. La calidad es espectacular. Se nota mucho la elaboración.
El ambiente y la atención inmejorables.
Son lo mejor..."
5,2023-02-16T23:34:10.838Z,Mauricio Sánchez García,https://www.google.com/maps/reviews/data=!4m8!14m7!1m6!2m5!1sChdDSUhNMG9nS0VJQ0FnSUNoMmRxMnhnRRAB!2m1!1s0x0:0x8f7d01d87fefd64b!3m1!1s2@1:CIHM0ogKEICAgICh2dq2xgE%7CCgwI8vq6nwYQ4OLdjwM%7C?hl=en,La pizza es deliciosa y la atención es muy buena. Recomendable 100%
5,2023-02-03T17:44:12.861Z,Iván García López,https://www.google.com/maps/reviews/data=!4m8!14m7!1m6!2m5!1sChZDSUhNMG9nS0VJQ0FnSUNoaU5HdWVnEAE!2m1!1s0x0:0x8f7d01d87fefd64b!3m1!1s2@1:CIHM0ogKEICAgIChiNGueg%7CCgwI7I_1ngYQyJPZmgM%7C?hl=en,
5,2023-01-22T10:52:14.917Z,Jesús Ángel Rubio Hernández,https://www.google.com/maps/reviews/data=!4m8!14m7!1m6!2m5!1sChdDSUhNMG9nS0VJQ0FnSURCc2QtNGxnRRAB!2m1!1s0x0:0x8f7d01d87fefd64b!3m1!1s2@1:CIHM0ogKEICAgIDBsd-4lgE%7CCgwI3qq0ngYQ8L27tQM%7C?hl=en,
5,2023-01-07T22:56:03.220Z,Eric Moreno-Vaquerizo Diaz,https://www.google.com/maps/reviews/data=!4m8!14m7!1m6!2m5!1sChZDSUhNMG9nS0VJQ0FnSUNCNzltVllREAE!2m1!1s0x0:0x8f7d01d87fefd64b!3m1!1s2@1:CIHM0ogKEICAgICB79mVYQ%7CCgsIg_HnnQYQoIuZaQ%7C?hl=en,"Estupenda pizzería.todo perfecto
Recomiendo la crazy pizza de locosss"
5,2022-12-25T21:37:37.379Z,Caroline Loiola,https://www.google.com/maps/reviews/data=!4m8!14m7!1m6!2m5!1sChZDSUhNMG9nS0VJQ0FnSUNCem9XM0NBEAE!2m1!1s0x0:0x8f7d01d87fefd64b!3m1!1s2@1:CIHM0ogKEICAgICBzoW3CA%7CCgwIoYWjnQYQ4KHptAE%7C?hl=en,"Las pizzas estaban riquísimas, pedimos la de trufa y setas y la caprichosa. Además la atención ha sido de 10!"
5,2022-12-18T08:13:32.458Z,Lola Argumánez Sierra,https://www.google.com/maps/reviews/data=!4m8!14m7!1m6!2m5!1sChZDSUhNMG9nS0VJQ0FnSUNCMU1tUEd3EAE!2m1!1s0x0:0x8f7d01d87fefd64b!3m1!1s2@1:CIHM0ogKEICAgICB1MmPGw%7CCgwIrJf7nAYQgOm92gE%7C?hl=en,"Las mejores Pizzas del mundo incluidas las elaboradas en Italia!!!! La calidad de 10 y la atención inmejorable. Añadir que la música ambiental está acorde con el local (nada de regueton, lo que es de agradecer) lo que hace que todo sepa mucho mejor"
5,2022-12-16T13:48:00.270Z,Abraham montiel moreno,https://www.google.com/maps/reviews/data=!4m8!14m7!1m6!2m5!1sChZDSUhNMG9nS0VJQ0FnSUNCMkpEalBREAE!2m1!1s0x0:0x8f7d01d87fefd64b!3m1!1s2@1:CIHM0ogKEICAgICB2JDjPQ%7CCgwIkO7xnAYQwMfxgAE%7C?hl=en,"Pizzas de 10, masa fina e ingredientes muy cuidados, le he dado la vuelta a la carta de pizzas y a cada cual más rica!! Hasta la vegetal, que a priori pudiera dar pereza pedirla (al menos a mí).... pues la he pedido dos veces ya, pq es espectacular!! Enhorabuena equipo, os deseo mucho éxito!"
4,2022-12-01T22:17:33.685Z,Deborah Garcia,https://www.google.com/maps/reviews/data=!4m8!14m7!1m6!2m5!1sChdDSUhNMG9nS0VJQ0FnSUQtNGRLZHR3RRAB!2m1!1s0x0:0x8f7d01d87fefd64b!3m1!1s2@1:CIHM0ogKEICAgID-4dKdtwE%7CCgwI_c-knAYQ-InZxgI%7C?hl=en,"He comido y cenado varias veces y nunca me canso. Pizzas variadas, tanto clásicas como especiales, muy ricas y con ingredientes de calidad
Los postres son una maravilla, sobretodo la tarta de tres leches, mi favorita!!
El local es pequeño pero acogedor y los camareros muy amables"
5,2022-11-26T15:48:37.206Z,Carmen,https://www.google.com/maps/reviews/data=!4m8!14m7!1m6!2m5!1sChZDSUhNMG9nS0VJQ0FnSUQteXNMTFh3EAE!2m1!1s0x0:0x8f7d01d87fefd64b!3m1!1s2@1:CIHM0ogKEICAgID-ysLLXw%7CCgsI1eqInAYQyMuwYg%7C?hl=en,He vivido en Italia y la Pizzas Pande me han recordado mucho a pizza sitalianas.Ingredientes de calidad y muy buena cocina.Local con encanto.Y postres buenísimos.Sin duda uno de los mejores sitios para comer en esta zona.
5,2022-11-12T22:27:12.015Z,cristina añover,https://www.google.com/maps/reviews/data=!4m8!14m7!1m6!2m5!1sChdDSUhNMG9nS0VJQ0FnSUMtczhpUnNBRRAB!2m1!1s0x0:0x8f7d01d87fefd64b!3m1!1s2@1:CIHM0ogKEICAgIC-s8iRsAE%7CCgsIwLvAmwYQsPe7Bw%7C?hl=en,
5,2022-11-06T14:53:06.076Z,Jesus Villafranca,https://www.google.com/maps/reviews/data=!4m8!14m7!1m6!2m5!1sChdDSUhNMG9nS0VJQ0FnSUMtMGNtSXB3RRAB!2m1!1s0x0:0x8f7d01d87fefd64b!3m1!1s2@1:CIHM0ogKEICAgIC-0cmIpwE%7CCgsI0pSfmwYQwPjRJA%7C?hl=en,"Comida casera, buenísima.....""espectacular"". Trato aún mejor. 👌👌👌 Lo recomiendo 100%"
5,2022-10-29T14:26:04.938Z,Laura,https://www.google.com/maps/reviews/data=!4m8!14m7!1m6!2m5!1sChdDSUhNMG9nS0VJQ0FnSUMtM015MTF3RRAB!2m1!1s0x0:0x8f7d01d87fefd64b!3m1!1s2@1:CIHM0ogKEICAgIC-3My11wE%7CCgwI_O_0mgYQiK_JvwM%7C?hl=en,"Pizzas Pande, una pizzería con encanto ,pizzas buenísimas,excelente trato,amplia variedad en carta y postres caseros.
Repetiremos,sin duda"
5,2022-10-28T23:43:01.281Z,Antonio Fuentes,https://www.google.com/maps/reviews/data=!4m8!14m7!1m6!2m5!1sChdDSUhNMG9nS0VJQ0FnSUMtckx6RWxBRRAB!2m1!1s0x0:0x8f7d01d87fefd64b!3m1!1s2@1:CIHM0ogKEICAgIC-rLzElAE%7CCgwIhdLxmgYQoIaXhgE%7C?hl=en,"Qué pasada de pizza. Es increíble, no he probado nada que se le parezca. Calidad suprema"
4,2022-10-27T19:55:58.553Z,darius capata,https://www.google.com/maps/reviews/data=!4m8!14m7!1m6!2m5!1sChdDSUhNMG9nS0VJQ0FnSUMtbEs3MS1BRRAB!2m1!1s0x0:0x8f7d01d87fefd64b!3m1!1s2@1:CIHM0ogKEICAgIC-lK71-AE%7CCgwIzsTrmgYQ4MLfhwI%7C?hl=en,"La verdad que nos gustó mucho toda la variedad de pizza que comimos, me hubiera gustado que tuviera la pizza napolitana y alguna pizza dulce! Merece la pena probar una pizza en PANDE!!"
5,2022-10-16T14:39:46.383Z,ALEXANDRA LAGAR,https://www.google.com/maps/reviews/data=!4m8!14m7!1m6!2m5!1sChdDSUhNMG9nS0VJQ0FnSURlemZEVnN3RRAB!2m1!1s0x0:0x8f7d01d87fefd64b!3m1!1s2@1:CIHM0ogKEICAgIDezfDVswE%7CCgwIsq-wmgYQgNWGtwE%7C?hl=en,
5,2022-10-05T19:20:15.618Z,Mercedes Acevedo,https://www.google.com/maps/reviews/data=!4m8!14m7!1m6!2m5!1sChZDSUhNMG9nS0VJQ0FnSURld3FQbENnEAE!2m1!1s0x0:0x8f7d01d87fefd64b!3m1!1s2@1:CIHM0ogKEICAgIDewqPlCg%7CCgwI77H3mQYQwMH1pgI%7C?hl=en,Pizzas buenísimas de gran calidad ! Personal encantador con gran don de gentes y mano excelente para la cocina .ParA volver 40 veces .
5,2022-10-04T18:24:27.051Z,Confiasistencia Toledo,https://www.google.com/maps/reviews/data=!4m8!14m7!1m6!2m5!1sChZDSUhNMG9nS0VJQ0FnSURlbk51NlZnEAE!2m1!1s0x0:0x8f7d01d87fefd64b!3m1!1s2@1:CIHM0ogKEICAgIDenNu6Vg%7CCgsI2_TxmQYQyOi0GA%7C?hl=en,"Las mejores pizzas y por fin Aperol y bueno!
Volveré!"
5,2022-10-03T12:24:54.132Z,Daniela A Godoy,https://www.google.com/maps/reviews/data=!4m8!14m7!1m6!2m5!1sChZDSUhNMG9nS0VJQ0FnSURldE1iSGRREAE!2m1!1s0x0:0x8f7d01d87fefd64b!3m1!1s2@1:CIHM0ogKEICAgIDetMbHdQ%7CCgsIlqnrmQYQ0M_-Pg%7C?hl=en,"Las mejores pizzas de quintanar, la mejor tapa italiana y el mejor helado artesanal estan aqui. Soy muy fan. El trato amable y cercano. Gracias"
5,2022-10-01T22:53:56.501Z,Beatriz N,https://www.google.com/maps/reviews/data=!4m8!14m7!1m6!2m5!1sChZDSUhNMG9nS0VJQ0FnSURlLUxYTk1REAE!2m1!1s0x0:0x8f7d01d87fefd64b!3m1!1s2@1:CIHM0ogKEICAgIDe-LXNMQ%7CCgwIhIrjmQYQ8KKl7wE%7C?hl=en,
5,2022-10-01T19:08:36.474Z,Bianca Comesaña,https://www.google.com/maps/reviews/data=!4m8!14m7!1m6!2m5!1sChdDSUhNMG9nS0VJQ0FnSURldVAtTHZBRRAB!2m1!1s0x0:0x8f7d01d87fefd64b!3m1!1s2@1:CIHM0ogKEICAgIDeuP-LvAE%7CCgwItKDimQYQqKmo4gE%7C?hl=en,"Las mejores pizzas de la zona! De una calidad inigualable, tanto los productos que utilizan, como la masa! 🤩 Además de las pizzas, las pastas y ensaladas estan increibles, y tienen unos postres caseros riquisimos (dios mio, la tres leches!!!)"
5,2022-09-24T13:06:33.564Z,Francisco Campillo,https://www.google.com/maps/reviews/data=!4m8!14m7!1m6!2m5!1sChdDSUhNMG9nS0VJQ0FnSUNlbThUSDVBRRAB!2m1!1s0x0:0x8f7d01d87fefd64b!3m1!1s2@1:CIHM0ogKEICAgICem8TH5AE%7CCgwI2YG8mQYQyLmpjQI%7C?hl=en,
5,2022-09-24T13:02:44.159Z,Rodrigo Flores,https://www.google.com/maps/reviews/data=!4m8!14m7!1m6!2m5!1sChZDSUhNMG9nS0VJQ0FnSUNlbTRUM1l3EAE!2m1!1s0x0:0x8f7d01d87fefd64b!3m1!1s2@1:CIHM0ogKEICAgICem4T3Yw%7CCgsI9P-7mQYQ6KKNTA%7C?hl=en,"Yo voy alguna que otra vez, y la verdad que me gusta mucho, las pizzas están muy buenas"
5,2022-09-18T10:20:30.061Z,Francisco Castellanos,https://www.google.com/maps/reviews/data=!4m8!14m7!1m6!2m5!1sChdDSUhNMG9nS0VJQ0FnSUNldWVDT2pRRRAB!2m1!1s0x0:0x8f7d01d87fefd64b!3m1!1s2@1:CIHM0ogKEICAgICeueCOjQE%7CCgsI7uGbmQYQkKKLHQ%7C?hl=en,"Las mejores pizzas que he probado, pedimos la de matanza y trufa con setas, los postres espectaculares. El servicio muy bueno y atento. Los tiempos de espera muy bien. Un local bonito y agradable, aunque estuvimos en la terraza. Cómo está en una calle peatonal puedes despreocupate de los niños un poco. Si te gustan las pizzas vas a alucinar. Volveremos pronto"
5,2022-08-31T13:39:59.094Z,Juan Garrido,https://www.google.com/maps/reviews/data=!4m8!14m7!1m6!2m5!1sChZDSUhNMG9nS0VJQ0FnSUR1NTcydWFBEAE!2m1!1s0x0:0x8f7d01d87fefd64b!3m1!1s2@1:CIHM0ogKEICAgIDu572uaA%7CCgsIr8m9mAYQ2I-DLQ%7C?hl=en,"Pedimos pizzas para llevar y en veinte minutos las recogimos. Ya nos habían hablado de estas pizzas y las queríamos probar: nos encantaron.

La masa es espectacular, seguro que ni los que se suelen dejar el borde lo dejan. Pedimos una pizza de pepperoni, un poco picantita, que nos pareció la mejor. Un must si vais y os gusta el pepperoni. También pedimos una suprema que estaba muy rica, pero la de pepperoni es otro rollo.

Sin duda un sitio para volver una y mil veces."
5,2022-08-30T11:02:09.747Z,Angel Vallejo Merino,https://www.google.com/maps/reviews/data=!4m8!14m7!1m6!2m5!1sChdDSUhNMG9nS0VJQ0FnSUR1Ml9YTXF3RRAB!2m1!1s0x0:0x8f7d01d87fefd64b!3m1!1s2@1:CIHM0ogKEICAgIDu2_XMqwE%7CCgwIsdy3mAYQiP3G5AI%7C?hl=en,"Estupendo, un restaurante para ir a menudo, los precios son más que razonables, pizzas de verdad, de las auténticas, sin masas comerciales.
Los helados artesanos con variedad de sabores muy buenos.
tienes variedad en la carta.
Todo el personal es atento, trabajador y con la mejor atención posible.
Gracias por mantener negocios así!!!
Lo recomiendo"
5,2022-08-27T20:43:34.294Z,Blanca Ramírez,https://www.google.com/maps/reviews/data=!4m8!14m7!1m6!2m5!1sChdDSUhNMG9nS0VJQ0FnSUR1X2ZfZDlBRRAB!2m1!1s0x0:0x8f7d01d87fefd64b!3m1!1s2@1:CIHM0ogKEICAgIDu_f_d9AE%7CCgwI9oOqmAYQ0I_QjAE%7C?hl=en,
4,2022-08-27T07:23:06.751Z,Sebastián Pérez,https://www.google.com/maps/reviews/data=!4m8!14m7!1m6!2m5!1sChZDSUhNMG9nS0VJQ0FnSUR1bmRhQklREAE!2m1!1s0x0:0x8f7d01d87fefd64b!3m1!1s2@1:CIHM0ogKEICAgIDundaBIQ%7CCgwI2oynmAYQ4N2z5gI%7C?hl=en,"Todo un descubrimiento. Pequeña pizzeria con una terraza cubierta bastante grande en una calle peatonal.
Las pizzas son realmente buenas. Masa fina casera y buena cantidad de ingredientes. Muy ricas.
La pasta también está bien, sobre todo por las salsas caseras.
De postre, la tarta tres leche vale la pena.
Todo muy casero y artesanal."
5,2022-08-26T20:24:49.400Z,Tomas Moreno,https://www.google.com/maps/reviews/data=!4m8!14m7!1m6!2m5!1sChdDSUhNMG9nS0VJQ0FnSUR1cmRtTTNBRRAB!2m1!1s0x0:0x8f7d01d87fefd64b!3m1!1s2@1:CIHM0ogKEICAgIDurdmM3AE%7CCgwIkdikmAYQ2OH8vgE%7C?hl=en,
4,2022-08-24T10:16:17.608Z,Toni García,https://www.google.com/maps/reviews/data=!4m8!14m7!1m6!2m5!1sChZDSUhNMG9nS0VJQ0FnSUR1bWZMWURREAE!2m1!1s0x0:0x8f7d01d87fefd64b!3m1!1s2@1:CIHM0ogKEICAgIDumfLYDQ%7CCgwI8fSXmAYQsI2logI%7C?hl=en,
5,2022-08-20T21:06:51.129Z,Ivan Zafra,https://www.google.com/maps/reviews/data=!4m8!14m7!1m6!2m5!1sChZDSUhNMG9nS0VJQ0FnSUR1am9mUVd3EAE!2m1!1s0x0:0x8f7d01d87fefd64b!3m1!1s2@1:CIHM0ogKEICAgIDujofQWw%7CCgsI65mFmAYQyPbnPQ%7C?hl=en,"Estupendo, un restaurante para ir a menudo, los precios son más que razonables, pizzas de verdad, de las auténticas, sin masas comerciales. Los helados artesanos con variedad de sabores muy buenos. Nosotros nos desplazamos a una hora dé trayecto y merece más que la pena, tienes variedad en la carta. La próxima vez probaremos más de la carta, la pasta está en nuestra siguiente visita. Todo el personal es atento, trabajador y con la mejor atención posible. Gracias por mantener negocios así!!!"
5,2022-08-19T20:51:49.403Z,Fer Egido,https://www.google.com/maps/reviews/data=!4m8!14m7!1m6!2m5!1sChZDSUhNMG9nS0VJQ0FnSUR1NXJIN1h3EAE!2m1!1s0x0:0x8f7d01d87fefd64b!3m1!1s2@1:CIHM0ogKEICAgIDu5rH7Xw%7CCgwI5e__lwYQuMnKwAE%7C?hl=en,Caseras muy ricas
5,2022-08-16T16:04:21.828Z,Rafa Arnedo,https://www.google.com/maps/reviews/data=!4m8!14m7!1m6!2m5!1sChZDSUhNMG9nS0VJQ0FnSUR1d3Q2SktREAE!2m1!1s0x0:0x8f7d01d87fefd64b!3m1!1s2@1:CIHM0ogKEICAgIDuwt6JKQ%7CCgwIhYDvlwYQ0P_yigM%7C?hl=en,Hemos comido genial. La masa de la pizza en su punto! 100% recomendable
5,2022-08-13T21:55:56.756Z,Sergio Escudero Mota,https://www.google.com/maps/reviews/data=!4m8!14m7!1m6!2m5!1sChdDSUhNMG9nS0VJQ0FnSUR1cE5HdjZBRRAB!2m1!1s0x0:0x8f7d01d87fefd64b!3m1!1s2@1:CIHM0ogKEICAgIDupNGv6AE%7CCgwI7LvglwYQgOTf6AI%7C?hl=en,"Puedo decir que me he comido la mejor pizza de mi vida y ha sido en quintanar, increíble."
5,2022-08-07T17:17:59.439Z,Japesa Japesa,https://www.google.com/maps/reviews/data=!4m8!14m7!1m6!2m5!1sChdDSUhNMG9nS0VJQ0FnSUN1aDkzWG5BRRAB!2m1!1s0x0:0x8f7d01d87fefd64b!3m1!1s2@1:CIHM0ogKEICAgICuh93XnAE%7CCgwIx-e_lwYQqKbc0QE%7C?hl=en,"Excelente!!!, fuimos desde Villanueva por los comentarios y todo exquisito,bien presentado con todo detalle, ingredientes de primera,la camarera que nos atendió toda una anfitriona,no supo recomendar y acertamos, sitio recomendable,.
Volveremos.
Seguir así.
Enhorabuena!!!!"
5,2022-08-06T21:58:48.434Z,Stefan Vidovics,https://www.google.com/maps/reviews/data=!4m8!14m7!1m6!2m5!1sChdDSUhNMG9nS0VJQ0FnSUN1bTVLN29nRRAB!2m1!1s0x0:0x8f7d01d87fefd64b!3m1!1s2@1:CIHM0ogKEICAgICum5K7ogE%7CCgwImMi7lwYQiLKqzwE%7C?hl=en,"Genial.Pizza excelente. La camarera muy amable y atenta con los detalles del cliente. Al parecer tiene sugerencias a medida y muy acertadas. Sinceramente no hay motivos para poner ninguna pega. Todo perfecto. Ojala que duren mucho, se lo merecen. Gracias, volveré"
5,2022-08-06T19:10:11.095Z,Cristina LD,https://www.google.com/maps/reviews/data=!4m8!14m7!1m6!2m5!1sChZDSUhNMG9nS0VJQ0FnSUN1NjVYa05REAE!2m1!1s0x0:0x8f7d01d87fefd64b!3m1!1s2@1:CIHM0ogKEICAgICu65XkNQ%7CCgsIk_m6lwYQuIGnLQ%7C?hl=en,Las pizzas están genial. Muy ricas.
5,2022-07-30T07:39:25.044Z,Ivan Rioja García,https://www.google.com/maps/reviews/data=!4m8!14m7!1m6!2m5!1sChZDSUhNMG9nS0VJQ0FnSUN1b2MyZk5REAE!2m1!1s0x0:0x8f7d01d87fefd64b!3m1!1s2@1:CIHM0ogKEICAgICuoc2fNQ%7CCgsIrcCTlwYQuO6hFQ%7C?hl=en,"Sin duda, las mejores pizzas.
La pizza Pomona nos sucumbió.
En trato excelente 👌🏻"
5,2022-07-26T08:29:21.714Z,nines sesmero,https://www.google.com/maps/reviews/data=!4m8!14m7!1m6!2m5!1sChZDSUhNMG9nS0VJQ0FnSUN1bXY2bkp3EAE!2m1!1s0x0:0x8f7d01d87fefd64b!3m1!1s2@1:CIHM0ogKEICAgICumv6nJw%7CCgwI4cv-lgYQ-L7H1AI%7C?hl=en,
5,2022-07-16T21:54:11.928Z,Miriam,https://www.google.com/maps/reviews/data=!4m8!14m7!1m6!2m5!1sChdDSUhNMG9nS0VJQ0FnSURPai1qdHZnRRAB!2m1!1s0x0:0x8f7d01d87fefd64b!3m1!1s2@1:CIHM0ogKEICAgIDOj-jtvgE%7CCgwIg-fMlgYQuK7TugM%7C?hl=en,"Pizzas buenísimas, sitio muy agradable y muy buena atención al cliente.
Muy recomendable."
5,2022-07-09T20:26:35.174Z,Raquel Santos,https://www.google.com/maps/reviews/data=!4m8!14m7!1m6!2m5!1sChZDSUhNMG9nS0VJQ0FnSURPaGFLNGZREAE!2m1!1s0x0:0x8f7d01d87fefd64b!3m1!1s2@1:CIHM0ogKEICAgIDOhaK4fQ%7CCgsI-8inlgYQsIejUw%7C?hl=en,Que buenisimas estan las pizzas. La masa es riquisima y el trato perfecto. Volvere sin ninguna duda.
5,2022-07-09T18:24:40.104Z,Alfonso Nava Morales,https://www.google.com/maps/reviews/data=!4m8!14m7!1m6!2m5!1sChdDSUhNMG9nS0VJQ0FnSURPLVpPYTJBRRAB!2m1!1s0x0:0x8f7d01d87fefd64b!3m1!1s2@1:CIHM0ogKEICAgIDO-ZOa2AE%7CCgsI6I-nlgYQwMTlMQ%7C?hl=en,"Pizzas de autor, trato excelente."
5,2022-07-01T23:10:11.217Z,Fernando Sánchez,https://www.google.com/maps/reviews/data=!4m8!14m7!1m6!2m5!1sChZDSUhNMG9nS0VJQ0FnSURPOG9qUmJ3EAE!2m1!1s0x0:0x8f7d01d87fefd64b!3m1!1s2@1:CIHM0ogKEICAgIDO8ojRbw%7CCgsI0_39lQYQwLjEZw%7C?hl=en,Pizzas riquísimas. Ensalada caprese espectacular. Muy recomendable.
4,2022-06-15T11:57:44.529Z,Belén López,https://www.google.com/maps/reviews/data=!4m8!14m7!1m6!2m5!1sChdDSUhNMG9nS0VJQ0FnSUNPNWZQZXd3RRAB!2m1!1s0x0:0x8f7d01d87fefd64b!3m1!1s2@1:CIHM0ogKEICAgICO5fPewwE%7CCgwIuJKnlQYQiMnC_AE%7C?hl=en,Todo bien
5,2022-06-05T21:18:01.686Z,Manuel gutierrez ballesteros,https://www.google.com/maps/reviews/data=!4m8!14m7!1m6!2m5!1sChdDSUhNMG9nS0VJQ0FnSUNPa3ZLcnJ3RRAB!2m1!1s0x0:0x8f7d01d87fefd64b!3m1!1s2@1:CIHM0ogKEICAgICOkvKrrwE%7CCgwIibv0lAYQ6NqhxwI%7C?hl=en,"Muy buen sitio, realmente de diez.
Nos pillaba de paso para Madrid y nos hemos encontrado un lugar regentado por chicos jóvenes, bastante majos, con muchas ganas de trabajar, gran trato y atención al cliente.

La comida de mucha calidad, los postres caseros muy buenos. Sin duda un lugar al que seguramente pronto volveremos."
